OCCU_DESC,WK_TYPE,CJOB1_COUNT,CJOB_NAME1,CJOB2_COUNT,CJOB_NAME2,JOB_PERSON,STOP_DATE,JOB_DETAIL,CITYNAME,EXPERIENCE,WKTIME,SALARYCD,NT_L,NT_U,EDGRDESC,URL_QUERY,COMPNAME,TRANDATE
"業務專員(機場接送業務)(0506校徵)",全職,02,業務／貿易／銷售,020305,汽機車銷售人員,1,20250621,"◎#041.負責公司專接平台合作夥伴的開發與維護，包括企業客戶、車主資料及生態夥伴2.制定商務合作計畫，完成洽談、簽約及後續執行3.分析市場需求，挖掘新興商務合作領域4.配合市場策畫聯合推廣活動，提升平台品牌影響力5.主管交辦事項",台北市大安區,無,日班,月薪,35000,-,專科,"https://job.taiwanjobs.gov.tw/Internet/jobwanted/JobDetail.aspx?EMPLOYER_ID=1236&HIRE_ID=13491251","全鋒汽車股份有限公司",20250421
"粗工/技術工/打石工",全職,11,營建／製圖／施作,110309,粗工,30,20250617,"1.工地雜工，技術清潔工、打石工2.日薪、當日領工資",台北市不限,無,日班,日薪,1520,2200,不拘,"https://job.taiwanjobs.gov.tw/Internet/jobwanted/JobDetail.aspx?EMPLOYER_ID=1073722&HIRE_ID=13484877","上德信企業社",20250417
"資深餐飲服務員(全日餐廳)(0506校徵)",全職,16,旅遊／餐飲／休閒,160207,餐飲服務及接待員,4,20250618,"1.負責桌面擺設與整理，並確定所需物品一應俱全2.協助客人整理使用過不需要的餐具餐盤3.熟悉正確標準的服務作業流程，並作妥善的發揮4.清楚了解客人需要並給予適宜的協助",台北市中山區,無,日班,月薪,32000,37000,大學,"https://job.taiwanjobs.gov.tw/Internet/jobwanted/JobDetail.aspx?EMPLOYER_ID=2381717&HIRE_ID=13487975","國泰飯店管理顧問事業股份有限公司-民生建國分公司",20250418
"晚班櫃台",全職,16,旅遊／餐飲／休閒,160104,櫃檯服務人員,9,20250515,"1.預約電話接聽及現場貴賓接待。2.電腦排班，表報製作。3.收支結盈。4.維持環境整潔。此為現場徵才職缺【5/8(四)10:30-14:00於『真理大學』校園就業博覽會】，廠商完整職缺內容，請上新北人力網「附件下載」查看",台北市中山區,無,夜班,月薪,28590,40000,不拘,"https://job.taiwanjobs.gov.tw/Internet/jobwanted/JobDetail.aspx?EMPLOYER_ID=2450981&HIRE_ID=13512131","財鶴有限公司",20250501
"【台北捷運】水電系統維護人員(捷運信義線或新蘆線)",全職,11,營建／製圖／施作,110115,水電工程師,5,20250625,"1.維修捷運站水電、消防等設備2.捷運照明、給水與排水系統之保養維護3.具水電,消防設備維修經驗者佳4.緊急事故協助處理5.配合主管交辦事項★具有1年以上水電維護經驗或機電相關丙級技術士以上之證照者優先【萬金國際科技(股)公司+皓群科技(股)公司】汐止就服站-現場單一徵才活動活動時間：114/05/06(二)14:00-16:00活動地點：汐止就業服務站活動地址：新北市汐止區新台五路一段268號1樓 (汐止區公所1樓)活動資訊請開啟以下網址【https://ilabor.ntpc.gov.tw/cloud/GoodJob/activities_content/1035754764】",台北市不限,1年以上,日班、夜班、中班,月薪,30000,32000,高職,"https://job.taiwanjobs.gov.tw/Internet/jobwanted/JobDetail.aspx?EMPLOYER_ID=918779&HIRE_ID=13501109","皓群科技股份有限公司",20250425
"國會法案公費助理",全職,03,人資／法務／智財,030204,法律助理人員,1,20250505,"1. 協助研究撰寫法案、預算提案及委員質詢稿(具備powerpoint簡報製作能力)2. 協助政策、時事及原住民議題資料蒐集與研究3. 協助撰寫新聞稿及聲明稿4. 協助立法院委員會、院會開會相關議事討論工作5. 立法委員、主管其他交辦事項6. 無經驗可(願意努力學習者！)",台北市不限,無,日班,月薪,36000,51000,大學,"https://job.taiwanjobs.gov.tw/Internet/jobwanted/JobDetail.aspx?EMPLOYER_ID=2547407&HIRE_ID=13383141","立法委員盧縣一國會辦公室",20250307
"推展員(工作機會開發業務)",全職,01,經營／行政／總務,010206,行政助理,1,20250508,"1.	身心障礙工作機會開發相關事項。2.	提供身心障礙者就業服務等相關工作。3.	其他臨時交辦事項。",台北市萬華區,無,日班,月薪,39960,39960,大學,"https://job.taiwanjobs.gov.tw/Internet/jobwanted/JobDetail.aspx?EMPLOYER_ID=1151189&HIRE_ID=13495779","臺北市勞動力重建運用處",20250423
"<徵的是YOU >拉亞漢堡早午餐-正職人員【台北北市內湖門市】",全職,16,旅遊／餐飲／休閒,160207,餐飲服務及接待員,2,額滿為止,"1、餐點製作及品質標準之維持2、產品之銷售及服務3、硬體設備之清潔維護及門市環境清潔整理4、個性開朗，具基本之溝通能力其他條件對餐飲及服務工作有熱忱！",台北市內湖區,無,日班,月薪,28590,32000,高中,"https://job.taiwanjobs.gov.tw/Internet/jobwanted/JobDetail.aspx?EMPLOYER_ID=883191&HIRE_ID=13400587","森邦股份有限公司",20250311
"Subway 松德店誠徵長期餐飲服務人員",全職,16,旅遊／餐飲／休閒,160207,餐飲服務及接待員,2,額滿為止,"收銀操作，負責餐飲場所的內外場聯繫、顧客菜單諮詢、點餐供餐及桌面環境清潔。",台北市信義區,無,輪班二班制,月薪,31000,33000,高中,"https://job.taiwanjobs.gov.tw/Internet/jobwanted/JobDetail.aspx?EMPLOYER_ID=49896&HIRE_ID=13485143","凱味國際有限公司",20250418
"夜班正職5/8",全職,16,旅遊／餐飲／休閒,160207,餐飲服務及接待員,6,20250508,"服務、清潔(忠孝店)【信義站5/8(四)14:00-16:00現場徵才活動】",台北市大安區,無,日班,月薪,37500,-,高中,"https://job.taiwanjobs.gov.tw/Internet/jobwanted/JobDetail.aspx?EMPLOYER_ID=118098&HIRE_ID=13471255","錢櫃企業股份有限公司-忠孝分公司",20250411
"業務專員(此為現場徵才活動職缺)",全職,02,業務／貿易／銷售,020102,業務人員,2,20250520,"培訓分發部門後之職務功能如下：1. 零件產品線之推廣與銷售。2. 客戶關係開發與維繫3. 庫存控管。4. 銷售帳款管理。5. 推廣電子零件或IC等等產品。114年5月17日（六）「畢業季暨北市科技園區聯合招募活動」活動時間：114年5月17日（六）10：30 ～16：00 (請於15:30前入場)活動地點：臺北車站1樓車站大廳(臺北市中正區北平西路三號) 洽詢電話：02-2338-0277*****請親洽*****想要知道更多活動資訊詳情請查詢 https://okwork.gov.taipei",台北市松山區,無,日班,月薪,35000,-,大學,"https://job.taiwanjobs.gov.tw/Internet/jobwanted/JobDetail.aspx?EMPLOYER_ID=235479&HIRE_ID=13500473","好德科技股份有限公司",20250424
"旅遊服務業務（此為現場徵才活動職缺）",全職,02,業務／貿易／銷售,020102,業務人員,20,20250519,"114年5月17日（六）「畢業季暨北市科技園區聯合招募活動」活動時間：114年5月17日（六）10：30 ～16：00 (請於15:30前入場)活動地點：臺北車站1樓車站大廳(臺北市中正區北平西路三號) 洽詢電話：02-2338-0277*****請親洽*****想要知道更多活動資訊詳情請查詢 https://okwork.gov.taipei1.為旅客提供專業的國內外旅遊產品諮詢服務，讓客戶能在旅途中擁有最完美的體驗2.在電話、網路或現場與客戶互動，處理訂單和行程預訂等相關事務，傳遞快樂的旅遊氛圍3.維護顧客關係，提供完善的售後服務，滿足客戶需求並解決問題4.旅遊相關險種的銷售及推廣（EX：旅平險）",台北市內湖區,無,日班,月薪,40000,-,專科,"https://job.taiwanjobs.gov.tw/Internet/jobwanted/JobDetail.aspx?EMPLOYER_ID=823114&HIRE_ID=13450279","雄獅資訊科技股份有限公司",20250402
"環境清潔員(半日)",全職,19,清潔／家事／托育(保母),190104,環境清潔工,1,20250630,"打掃校園環境，維護校園清潔",台北市北投區,無,日班,部分工時(月薪),18000,18000,不拘,"https://job.taiwanjobs.gov.tw/Internet/jobwanted/JobDetail.aspx?EMPLOYER_ID=2460395&HIRE_ID=13509561","臺北市私立道生幼兒園",20250430
"照顧服務員",兼職,17,醫療／美容／保健,170113,照顧服務員,30,20250610,"依照長照2.0法規，如沐浴、擦澡、備餐、餵食等居家照顧長者",台北市中山區,無,日班、部份工時：時分至時分,時薪,270,270,不拘,"https://job.taiwanjobs.gov.tw/Internet/jobwanted/JobDetail.aspx?EMPLOYER_ID=2404849&HIRE_ID=13465333","元愷有限公司附設臺北市私立安愷居家長照機構",20250410
"居家服務督導員",全職,17,醫療／美容／保健,170130,居家服務督導員,1,20250901,"1.依公司理念、機構發展策略及計畫執行。2.居服員管理(人力調派、溝通與協調等)。3.維護個案管理(開案評估、定期訪視、照顧計畫調整等)。4.機構評鑑文件維護事項落實與執行。5.單位與個案間協調與主要溝通人員。6.主管交辦事項。",台北市不限,1年內,日班,月薪,35000,38000,高職,"https://job.taiwanjobs.gov.tw/Internet/jobwanted/JobDetail.aspx?EMPLOYER_ID=2479615&HIRE_ID=13071861","優活健康顧問有限公司附設臺北市私立優活居家長照機構",20241029
"【大阪王將】信義威秀店-內、外場兼職服務夥伴",兼職,16,旅遊／餐飲／休閒,160207,餐飲服務及接待員,3,20250610,"↗外場服務夥伴↙1. 餐桌佈置及整潔服務2. 顧客接待及座位安排3. 回覆顧客點餐需求與提供建議4. 提供顧客桌邊服務5. 內場廚房支援備料6. 整潔門市環境與餐具保養↗內場服務夥伴↙1.負責洗、剝、削、切各種食材，以完成烹飪的前置工作2.協助廚師測量食材的容量與重量3.分切流程作業4.食材分裝分包",台北市信義區,無,部份工時：時分至時分,時薪,225,247,高職,"https://job.taiwanjobs.gov.tw/Internet/jobwanted/JobDetail.aspx?EMPLOYER_ID=2311647&HIRE_ID=13468061","王座國際餐飲股份有限公司",20250410
"櫃台客服專員",全職,06,客服／門市,060102,客戶服務人員,1,額滿為止,"1.兒童美語課程內容解說及業務招生。2.接待家長及學員服務。3.負責櫃台事務。4.另有季績效獎金。正向樂觀主動積極有補教業經驗佳公司會提供訓練輔導協助",台北市士林區,無,,月薪,30000,33000,專科,"https://job.taiwanjobs.gov.tw/Internet/jobwanted/JobDetail.aspx?EMPLOYER_ID=2565015&HIRE_ID=13509541","科見文教資訊股份有限公司附設臺北市私立科見文理短期補習班士林一分班",20250430
"台北業務代表_開店顧問 ■無經驗可→(此為現場徵才活動職缺)",全職,02,業務／貿易／銷售,020102,業務人員,2,20250519,"1.了解網路產業，並且關注關於網路上的新知。2.具有業務力，善於經營人脈互相分享資源，並能夠專注完成目標。3.熟悉欲銷售的公司產品（包含但不限於WACA）、公司規章作業流程，並且能介紹讓客戶學會基礎使用。114年5月17日（六）「畢業季暨北市科技園區聯合招募活動」活動時間：114年5月17日（六）10：30 ～16：00 (請於15:30前入場)活動地點：臺北車站1樓車站大廳(臺北市中正區北平西路三號) 洽詢電話：02-2338-0277*****請親洽*****想要知道更多活動資訊詳情請查詢 https://okwork.gov.taipei",台北市南港區,無,日班,月薪,35000,-,不拘,"https://job.taiwanjobs.gov.tw/Internet/jobwanted/JobDetail.aspx?EMPLOYER_ID=2459185&HIRE_ID=13509593","哇寶國際資訊股份有限公司",20250430
"ISO專案管理師",全職,09,品管／製造／環衛,090106,ISO/品保人員,1,20251231,"1.文件新增/核准/發行與回收/廢止等。2.協助ISO認證作業執行與維護。3.協助ISO相關稽核作業。4.配合專案查核與執行。5.文管系統的建立與維護。6.主管臨時交辦事項。",台北市大安區,2年以上,日班,月薪,37000,40000,大學,"https://job.taiwanjobs.gov.tw/Internet/jobwanted/JobDetail.aspx?EMPLOYER_ID=1236&HIRE_ID=13318795","全鋒汽車股份有限公司",20250206
"【台北】會計助理 【總公司】 @好玩、活力、成長、信任",全職,04,財務／金融／保險,040105,會計/出納/記帳人員,1,額滿為止,"協助處理以下業務1. 旅館營業收入對帳、傳票編製及會計帳務處理2. 收發、記錄及彙整交易產生之原始憑證，並登錄至會計系統製作傳票3. 整理旅館各項費用支付之發票、單據4. 處理廠商貨款及費用等應付款項帳務5. 營業稅、國外佣金平台扣繳申報6. 其他主管交辦事項工作技能帳務查核與會計稽查、所得稅結算申報、稅務規劃與稅報╱納稅事項、稅務業務處理、結帳作業與帳務處理、會計或審計專業知識其他條件熟悉文中系統、有會計事務所1年以上經驗者尤佳",台北市中正區,1年以上,日班,月薪,34000,-,專科,"https://job.taiwanjobs.gov.tw/Internet/jobwanted/JobDetail.aspx?EMPLOYER_ID=2391877&HIRE_ID=13500645","小鹿文娛股份有限公司",20250428
"《月薪40，000元↑》【日商壽司郎】台北館前路店(旗艦店)-正職人員★歡迎二度就業、無經驗者★",全職,16,旅遊／餐飲／休閒,160207,餐飲服務及接待員,5,20250930,"﹌透過美味的壽司，將幸福傳遞下去﹌うまいすしを、腹一杯。うまいすしで、心も一杯。年年調薪、福利最多，歡迎對餐飲業有熱忱的你！⭕獎金福利【優良勤務津貼】每月優良勤務津貼(最高2，000元)【三節獎金】定額獎金、春酒抽獎活動【競賽獎金】每月店鋪競賽活動獎金【介紹獎金】介紹親朋好友入職，期滿可獲得3，000~10，000元獎金【輪調津貼】配合外縣市輪調者，皆享租屋津貼補助【其他津貼】結婚生育津貼、喪葬慰問金、生日禮券、全勤禮券、在職進修、年度健檢津貼、員工用餐優惠【夏、冬季獎金】一年兩次獎金發放（幹部限定福利，依公司營運狀況及職等考核調整）⭕職位發展（實力主義不論年資，店長年薪百萬）【年薪1，330，000】區經理【年薪1，060，000】店長【年薪770，000】副店長【年薪640，000】主任▪以上最高年薪預估僅含夏、冬季獎金，尚未包含他項獎金或津貼▪新進正職人員月薪40，000元起（內含特殊獎金），每年兩次考核⭕工作內容（在職教育訓練完善，無經驗者OK）▪外場帶客入座→用餐說明、顧客服務→桌面清潔→環境整理→收銀結帳 等▪內場商品進貨→食材處理→餐點製作→餐具清洗→環境整理→庫存盤點 等⭕工作時間▪需配合08:30~24:00輪班（每日排班8小時）▪月休天數：公司依照人事行政局訂定每月紅字日數排休⭕企業魅力▪加班費為5分鐘為單位計算，重視員工的辛勤付出。▪實力主義不論年資，且制度完善、升遷調薪快速，適合具有企圖心的您。▪學習日系企業商業禮儀、餐飲相關專業技能，並能接觸店舖經營管理。▪展店計畫涵蓋全台灣，目標成為台灣第一迴轉壽司品牌。▪傾聽員工訴求，共同打造「以人為本」的舒適工作環境。",台北市中正區,無,,月薪,40000,42500,不拘,"https://job.taiwanjobs.gov.tw/Internet/jobwanted/JobDetail.aspx?EMPLOYER_ID=2370831&HIRE_ID=13372371","台灣壽司郎股份有限公司",20250307
"吉品海鮮-正職洗碗人員(敦南店)",全職,16,旅遊／餐飲／休閒,160207,餐飲服務及接待員,1,20251231,"1.洗滌餐廳內餐具器皿2.維護及整理洗碗區域環境衛生3.清理洗碗區廚餘及處理垃圾4.協助清潔餐廳環境(清潔人員休息時)5.主管交辦其他事項*需久站及配合排班",台北市松山區,無,日班、夜班、輪班二班制,月薪,34500,36700,不拘,"https://job.taiwanjobs.gov.tw/Internet/jobwanted/JobDetail.aspx?EMPLOYER_ID=975525&HIRE_ID=13203391","吉品海鮮股份有限公司敦南分公司",20250306
"培立 生活輔導員",全職,01,經營／行政／總務,010105,儲備幹部,1,額滿為止,"1.	協助保護安置之12-18歲少男，身心安頓及自立成長。2.	輪值住宿，關懷園生作息、輔導課業或就業、培植自立技能、協辦或參與研習、團輔活動等。3.	撰寫服務記錄、自立評估…表單，及相關行政庶務等。1.	具關懷失家少年熱忱，溫暖、細心、負責、具團隊精神。2.	開始上班：即起~一個月內。3.	工作時間：排班制，需值夜班、過年及例假日配合排班。",台北市大同區,2年以上,輪班三班制,月薪,36000,36000,高中,"https://job.taiwanjobs.gov.tw/Internet/jobwanted/JobDetail.aspx?EMPLOYER_ID=427444&HIRE_ID=13469189","社團法人中華育幼機構兒童關懷協會",20250416
"【杏子豬排】南港Citylink店-兼職/計時/工讀夥伴",兼職,22,其他職類,220101,兼職人員,2,20250503,"↗外場服務夥伴↙1. 餐桌佈置及整潔服務2. 顧客接待及座位安排3. 回覆顧客點餐需求與提供建議4. 提供顧客桌邊服務5. 內場廚房支援備料6. 整潔門市環境與餐具保養↗內場服務夥伴↙1.負責洗、剝、削、切各種食材，以完成烹飪的前置工作2.協助廚師測量食材的容量與重量3.分切流程作業4.食材分裝分包",台北市南港區,無,部份工時：09時00分至18時00分,時薪,200,247,高中,"https://job.taiwanjobs.gov.tw/Internet/jobwanted/JobDetail.aspx?EMPLOYER_ID=2311647&HIRE_ID=13375105","王座國際餐飲股份有限公司",20250303
"數位平臺開發(資深)工程師「此為現場徵才活動職缺」",全職,08,資訊／軟體／系統,080202,軟(韌)體設計工程師,1,20250519,"負責遠傳數位平臺，會員系統，開發設計：1.數位服務平臺前端：開發使用者介面，提供商家/客服/內部使用者共3個Portal予使用者進行設定/查詢/執行報表， 以完成業務所需。2.數位服務平臺：開發API遠傳內部其它系統 或外部商家介接整合，核心系統優化。3.會員系統開發：遠傳心生活會員流程修改優化。114年5月17日（六）「畢業季暨北市科技園區聯合招募活動」活動時間：114年5月17日（六）10：30 ～16：00 (請於15:30前入場)活動地點：臺北車站1樓車站大廳(臺北市中正區北平西路三號) 洽詢電話：02-2338-0277*****請親洽*****想要知道更多活動資訊詳情請查詢 https://okwork.gov.taipei",台北市內湖區,無,日班,月薪,40000,-,不拘,"https://job.taiwanjobs.gov.tw/Internet/jobwanted/JobDetail.aspx?EMPLOYER_ID=44531&HIRE_ID=13432563","遠傳電信股份有限公司",20250325
"司機",全職,15,物流／運輸／資材,150103,小客(貨)車司機,1,20250618,"計畫配送瓦斯",台北市萬華區,無,日班,月薪,45000,50000,不拘,"https://job.taiwanjobs.gov.tw/Internet/jobwanted/JobDetail.aspx?EMPLOYER_ID=532259&HIRE_ID=13487839","大鈊企業有限公司",20250418
"拉亞-萬華儲備幹部【32k~38k含+獎金】",全職,01,經營／行政／總務,010105,儲備幹部,2,額滿為止,"榮獲連鎖早餐品牌幸福企業給自己一個更好的選擇、更好的未來→✅【工作內容】1.餐飲製作及品質標準維持2.餐飲銷售及服務3.硬體設備維護及門市環境清潔整理4.個性開朗，具基本之溝通能力5.上班時間為05:30~14:30如果你活潑愛熱鬧我們在找 YOU ☛ 學習成長、規劃未來就是現在!!其他條件對餐飲及服務工作有熱情，有衝勁的您，歡迎加入我們！",台北市萬華區,無,日班,月薪,32000,38000,高中,"https://job.taiwanjobs.gov.tw/Internet/jobwanted/JobDetail.aspx?EMPLOYER_ID=883191&HIRE_ID=13405245","森邦股份有限公司",20250312
"業務專員(台北業一課)",全職,02,業務／貿易／銷售,020102,業務人員,1,20250503,"1.業務拓展開發。2.業績目標管理與達成。3.業務拜訪及有效管理客戶關係。4.市場商情蒐集。5.各項業務交付任務。",台北市中正區,2年以上,日班,月薪,33000,35000,大學,"https://job.taiwanjobs.gov.tw/Internet/jobwanted/JobDetail.aspx?EMPLOYER_ID=87071&HIRE_ID=13378853","臺鹽實業股份有限公司",20250304
"房務部房務員(台北喜來登大飯店)",兼職,16,旅遊／餐飲／休閒,160105,房務員,5,20300601,"1.客房整理2.樓層公共區域清潔與維護",台北市中正區,無,日班、輪班二班制、部份工時：09時00分至17時30分、中班,月薪,30000,32000,專科,"https://job.taiwanjobs.gov.tw/Internet/jobwanted/JobDetail.aspx?EMPLOYER_ID=116707&HIRE_ID=12799695","寒舍餐旅管理顧問股份有限公司",20240529
"0508貴賓廳服務人員",全職,06,客服／門市,060102,客戶服務人員,4,額滿為止,"此為現場徵才職缺【5/8(四)10:30-14:00於『真理大學』校園就業博覽會】，廠商完整職缺內容，請上新北人力網「附件下載」查看1.辦理HAPPYGO卡、消費補登2.禮券、商品券之販售3.國外旅客退稅辦理4.換開三聯式發票5.店內諮詢及VipClub會員入會申辦等業務6.顧客問題處理及各項櫃台服。 工作時間：日班10:00-19:00、中班13:30-22:30. 用餐休息1小時.月休8-10日",台北市大安區,無,日班、中班,月薪,35600,35600,大學,"https://job.taiwanjobs.gov.tw/Internet/jobwanted/JobDetail.aspx?EMPLOYER_ID=152662&HIRE_ID=13512167","太平洋崇光百貨股份有限公司",20250501
"Cloud-Native雲原生研發工程師(此為現場徵才活動職缺)",全職,08,資訊／軟體／系統,080202,軟(韌)體設計工程師,3,20250519,"1.雲平台系統研究、設計及開發。2.微服務平台設計及開發。3.自有作業系統開發。4.自動化維運/測試開發。114年5月17日（六）「畢業季暨北市科技園區聯合招募活動」活動時間：114年5月17日（六）10：30 ～16：00 (請於15:30前入場)活動地點：臺北車站1樓車站大廳(臺北市中正區北平西路三號) 洽詢電話：02-2338-0277*****請親洽*****想要知道更多活動資訊詳情請查詢 https://okwork.gov.taipei",台北市內湖區,無,日班,月薪,45000,-,大學,"https://job.taiwanjobs.gov.tw/Internet/jobwanted/JobDetail.aspx?EMPLOYER_ID=2293285&HIRE_ID=13454325","廣盛科技股份有限公司",20250407
"地政助理(6)(具人派業務)",全職,01,經營／行政／總務,010302,行政總務人員,3,20250602,"地政資料處理，工作地點位於古亭地政事務所，歡迎二度就業及退休人士。 *需熟悉電腦操作，具備基本（國、台）語言溝通能力。 *年終獎金1.5個月薪資。服務期間未滿1年，依服務月份比例發給(需114年12月31日仍服務者)。 *投遞履歷時，請附上學歷證明，並註明是應徴哪個事務所。",台北市文山區,無,日班,月薪,33500,33500,高職,"https://job.taiwanjobs.gov.tw/Internet/jobwanted/JobDetail.aspx?EMPLOYER_ID=2489309&HIRE_ID=13451305","富信顧問股份有限公司",20250402
"清潔人員",全職,19,清潔／家事／托育(保母),190104,環境清潔工,5,20250629,"商業辦公室或社區清潔維護",台北市不限,1年以上,日班,月薪,29000,-,不拘,"https://job.taiwanjobs.gov.tw/Internet/jobwanted/JobDetail.aspx?EMPLOYER_ID=1118560&HIRE_ID=13508017","又潔清潔社 ",20250429
"國外業務助理",全職,02,業務／貿易／銷售,020201,國貿人員,1,20251231,"外語能力需求：這份工作主要以日語為主， 英語為副。 主要需具備日文文書作業的閱讀及電腦打字能力，並具備部分英文能力。日文與英文的比重大約為：日文佔80%，英文佔20%。外語書寫跟翻譯可使用google translate或者其他翻譯軟體輔助完成書信。若能流利地用日語口語與日本人溝通，將被視為額外加分項目。雖然此工作較少需要與日本客人進行口語溝通，但在日本客人來訪時，需要能夠進行基本的問候交流。處理國際貿易事務，如進出口作業、安排貨物運輸業務、市場開發、接訂單等工作。1.協助外銷業務推廣、行銷企劃、參展，進出口文件製作及船務報關， 押匯等作業。 2.主要是協助業務拓展客戶開發.產品行銷，建立網路社群，官網更新， 拓展整個業務市場 工作樂趣與成就感: 藉由跟客戶溝通，可了解客戶需求培養對客戶敏銳度，或產品適用性。3. 有相關國貿業務者可優先錄取。4. 必要時可以協助編輯產品目錄， 會美編能力優先錄取。",台北市大同區,2年以上,日班,月薪,33000,36000,專科,"https://job.taiwanjobs.gov.tw/Internet/jobwanted/JobDetail.aspx?EMPLOYER_ID=45489&HIRE_ID=13241981","瑞通行貿易有限公司",20250107
"實習生-產業研究＆活動行銷各一名",全職,14,教育／學術／研究,140202,研究助理,2,20250502,"【工作內容】- 產業研究 * 產業資訊彙整與研究。 * 資料收集、分析與編輯。 * 支援各項專案活動。 * 主管指派交辦事宜。【工作內容】- 活動行銷 * CRM、電子報、官網後台維護管理(名單、圖文上線)。 * 協助專案行銷企劃與執行(包括各種形式之線上線下活動)。 * 社群經營。 * 主管指派交辦事宜。",台北市大安區,無,,時薪,220,250,大學,"https://job.taiwanjobs.gov.tw/Internet/jobwanted/JobDetail.aspx?EMPLOYER_ID=2556347&HIRE_ID=13371997","台灣創生平台股份有限公司",20250303
