OCCU_DESC,WK_TYPE,CJOB1_COUNT,CJOB_NAME1,CJOB2_COUNT,CJOB_NAME2,JOB_PERSON,STOP_DATE,JOB_DETAIL,CITYNAME,EXPERIENCE,WKTIME,SALARYCD,NT_L,NT_U,EDGRDESC,URL_QUERY,COMPNAME,TRANDATE
"【乾杯】營業三部-專員~主任(毛孩乾杯&乾杯選物)",全職,02,業務／貿易／銷售,020103,業務助理,1,額滿為止,"1. 訂單、庫存與物流管理協助業務處理訂單、報價、合約與客戶往來文件送審處理。處理各平台、通路訂單，確保準確出貨。進行轉單ＫＥＹ單等訂單確認、操作關貿系統、開立發票對帳與結帳作業。監控庫存狀況，確保安全庫存量，並與倉儲單位溝通補貨計畫。2. 業務與客戶支援協助業務處理報價、合約、銷售報表與行政作業。回應客戶（電商客服/經銷商）詢問，提供產品資訊及售後服務。3. 數據與市場分析協助業務分析各通路銷售數據。進行競品市場調查，提供市場趨勢分析報告。4. 行銷與推廣支援協助電商平台促銷活動執行、商品上架與資訊維護。參與寵物展、促銷活動，協助品牌曝光與客戶接洽。5. 其他主管交辦事項。個人特質：細心負責，擅長跨部門溝通與問題解決對寵物產業有興趣，了解電商與實體零售運作模式工作技能電商營運、庫存管理規劃作業其他條件1.商業、行銷、供應鏈管理相關科系尤佳2.具零售、寵物食品產業、電商或業務助理經驗者優先3.熟悉Excel、Word，具電商後台操作或數據分析能力佳4.系統操作：熟悉SAP、關貿系統操作系統尤佳",台北市中正區,1年以上,日班,月薪,33000,41000,專科,"https://job.taiwanjobs.gov.tw/Internet/jobwanted/JobDetail.aspx?EMPLOYER_ID=933158&HIRE_ID=13430797","乾杯股份有限公司",20250324
"堤諾Tino's Pizza Café【連鎖餐飲集團 晚班兼職夥伴】民生門市★通過各級考核與加計工作獎金，時薪可達$210以上★",全職,16,旅遊／餐飲／休閒,160207,餐飲服務及接待員,1,額滿為止,"【職務內容】 1.門市外場服務及管理學習、執行。2.門市內場廚房各項工作站技能學習、獨立作業。3.通過各級考核與加計工作獎金，時薪最高可達210元以上 。4.無經驗可其他條件個性活潑開朗，具備服務熱忱，歡迎加入我們團隊!",台北市中山區,無,日班、夜班,時薪,190,-,高中,"https://job.taiwanjobs.gov.tw/Internet/jobwanted/JobDetail.aspx?EMPLOYER_ID=883191&HIRE_ID=13408241","森邦股份有限公司",20250313
"KCLF1【乾杯】總部 行銷課-專員/高專",全職,21,行銷／企劃／專案,210103,行銷企劃人員,1,額滿為止,"1.SNS自媒體平台：經營管理/行銷規劃/成效評估(品牌官網/Facebook/Instagram/Threads/Line OA/Google商家)2.CRM會員活動平台：帳號操作管理/成效評估3.行銷活動文案撰寫/執行/成效評估4.SNS私訊及行銷相關事務處理5.其他主管交辦事項其他條件1.一年以上行銷經驗，品牌行銷經驗者佳2.能夠快速學習，熟悉使用線上工具及快速掌握餐飲產業訊息者將優先考慮3.具備良好溝通技巧、團隊合作精神和責任感4.具備英語或日語能力者加分",台北市中正區,1年以上,日班,月薪,33000,38000,專科,"https://job.taiwanjobs.gov.tw/Internet/jobwanted/JobDetail.aspx?EMPLOYER_ID=933158&HIRE_ID=13430697","乾杯股份有限公司",20250324
"托嬰中心托育人員",全職,14,教育／學術／研究,140102,幼教老師,2,20250503,"※須具備幼兒保育科系或護理系畢業，或具備保母證照1.提供嬰幼兒日常生活(如：飲食、大小便等)的照顧，並保護其安全2.教導嬰幼兒良好的基本生活習慣，包含自理飲食、衛生習慣等基礎生活技能3.嬰幼兒發展階段學習活動安排及陪伴4.告知並與家長共同討論嬰幼兒的需求與發展",台北市松山區,無,日班,月薪,35000,38000,高職,"https://job.taiwanjobs.gov.tw/Internet/jobwanted/JobDetail.aspx?EMPLOYER_ID=2535223&HIRE_ID=13373955","臺北市私立天使寶貝蒙特梭利托嬰中心",20250303
"急徵托育人員",全職,19,清潔／家事／托育(保母),190301,托育(保母)人員,3,20250526,"1.提供0~12歲家中突遭變故之兒童，緊急或短期的安置照顧，給予生活照顧醫療需求服務及危機處理，協助兒童身心穩定。 2.能參與排班，願意與其他工作人員（社工員或保育員）共同合作，提供嬰幼兒規律一致的照顧。 3.其他交辨事項。",台北市文山區,無,輪班二班制,月薪,36000,42000,高職,"https://job.taiwanjobs.gov.tw/Internet/jobwanted/JobDetail.aspx?EMPLOYER_ID=5533&HIRE_ID=13434247","財團法人天主教福利會",20250326
"收銀兼職人員(0506校徵)",全職,22,其他職類,220101,兼職人員,3,20250621,"1.負責收銀結帳2.顧客服務",台北市不限,無,,時薪,190,190,不拘,"https://job.taiwanjobs.gov.tw/Internet/jobwanted/JobDetail.aspx?EMPLOYER_ID=151935&HIRE_ID=13488857","宜家家居股份有限公司",20250421
"大樓清潔員",兼職,19,清潔／家事／托育(保母),190101,大樓及辦公室清潔員,1,20250930,"辦公大樓公區清潔。",台北市中山區,無,部份工時：06時30分至10時30分,月薪,28600,28600,不拘,"https://job.taiwanjobs.gov.tw/Internet/jobwanted/JobDetail.aspx?EMPLOYER_ID=44595&HIRE_ID=13305759","東建美護股份有限公司",20250415
"土建現場工程人員",全職,11,營建／製圖／施作,110103,營造經理人員,10,20331231,"1.督導各承包商依進度施工作業。2.協助主管依施工計畫及合約規範推動各項施工作業。3.依主管指派監督現場工程，追蹤工程進度以及控管施工品質。4.依主管指派現場工程事項安排及協調作業。5.工地品質、安全監督、工程進度安排及管理。6.主管交辦事項。現場的進度、管控成本、人力調度及勞工安全衛生等工程管理工作。",台北市不限,無,日班,月薪,37000,-,專科,"https://job.taiwanjobs.gov.tw/Internet/jobwanted/JobDetail.aspx?EMPLOYER_ID=615167&HIRE_ID=12148531","潤弘精密工程事業股份有限公司",20230727
"貴賓廳服務實習生",全職,22,其他職類,220101,兼職人員,32,20250515,"此為現場徵才職缺【5/8(四)10:30-14:00於『真理大學』校園就業博覽會】，廠商完整職缺內容，請上新北人力網「附件下載」查看1.辦理HAPPYGO卡、消費補登2.禮券、商品券之販售3.國外旅客退稅辦理4.換開三聯式發票5.店內諮詢及VipClub會員入會申辦等業務6.顧客問題處理及各項櫃台服",台北市不限,無,日班、中班,月薪,32000,-,大學,"https://job.taiwanjobs.gov.tw/Internet/jobwanted/JobDetail.aspx?EMPLOYER_ID=152662&HIRE_ID=13511229","太平洋崇光百貨股份有限公司",20250501
"房務員",全職,16,旅遊／餐飲／休閒,160105,房務員,3,20251231,"負責飯店／旅館內房間的打掃工作，協助整理房間清潔及補充消耗性用品。打掃內容供參考如下：→每日需打掃約11間(房間坪數5-9坪)，第12間開始每間另發獎金$130，每間大約30-40分鐘。",台北市中正區,無,日班,月薪,31000,33000,不拘,"https://job.taiwanjobs.gov.tw/Internet/jobwanted/JobDetail.aspx?EMPLOYER_ID=2537461&HIRE_ID=13464249","大員昌實業有限公司",20250411
"急徵 景美社區 清潔員",全職,19,清潔／家事／托育(保母),190102,清潔工／資源回收人員,1,額滿為止,"清潔工作區域，並處理垃圾分類、資源回收等工作。",台北市文山區,無,日班,月薪,29000,29000,不拘,"https://job.taiwanjobs.gov.tw/Internet/jobwanted/JobDetail.aspx?EMPLOYER_ID=81962&HIRE_ID=13392173","唐埕保全股份有限公司",20250307
"SI平台工程師 ■無經驗可「此為現場徵才活動職缺」",全職,08,資訊／軟體／系統,080104,網路安全工程師,3,20250519,"1.平台建置維運管理及維運操作。 2.進行平台系統查測及礙障排除。 3.日常工作報告，每月月報及季報資料整理。 4.其他交辦之工作事項。114年5月17日（六）「畢業季暨北市科技園區聯合招募活動」活動時間：114年5月17日（六）10：30 ～16：00 (請於15:30前入場)活動地點：臺北車站1樓車站大廳(臺北市中正區北平西路三號) 洽詢電話：02-2338-0277*****請親洽*****想要知道更多活動資訊詳情請查詢 https://okwork.gov.taipei",台北市中正區,1年以上,日班,依學經歷、證照核薪(每月經常性薪資達4萬元以上),-,-,不拘,"https://job.taiwanjobs.gov.tw/Internet/jobwanted/JobDetail.aspx?EMPLOYER_ID=1199795&HIRE_ID=13473981","宏華國際股份有限公司",20250414
"業務經理【OS維運部】",全職,02,業務／貿易／銷售,020101,業務主管,2,20250601,"1. 委外業務推廣及業務目標達成 2. 預算、競爭、人力合約、財務預測 3. 客戶關係管理 4. 推動與執行年度業務銷售計劃 其他條件： 1. 具人資、委外或派遣相關經驗佳 2. 個性主動積極、正面、願接受挑戰、溝通協調及學習能力佳 ",台北市松山區,3年以上,日班,依學經歷、證照核薪(每月經常性薪資達4萬元以上),-,-,專科,"https://job.taiwanjobs.gov.tw/Internet/jobwanted/JobDetail.aspx?EMPLOYER_ID=469231&HIRE_ID=13448417","普鴻資訊股份有限公司",20250401
"水處理助理工程師/ 工程師(台北) 請至104或1111投遞履歷",全職,10,技術／維修／操作,100102,電機技術人員,3,20250826,"【主要工作內容】A. 於客戶端現場量測冰水機性能（如COP、耗電量等），並記錄系統運轉數據。B. 進行水質測試，評估水處理設備對水質與系統效能的效益。C. 規劃並執行水處理設備安裝作業，包含現場配置與電線配線。D. 分析安裝前後的效能數據，驗證改善成效，撰寫技術評估與節能報告。E. 前往客戶現場進行設備現況勘查，建立方案設計與改善建議。◦ 有相關工作經驗者優先，尤其在設備安裝或節能領域有經驗者更佳。◦ 具備學習能力與團隊合作精神的應屆畢業生也非常歡迎。◦ 能接受出差至客戶現場工作。",台北市北投區,1年內,日班,月薪,35000,41000,高職,"https://job.taiwanjobs.gov.tw/Internet/jobwanted/JobDetail.aspx?EMPLOYER_ID=10721&HIRE_ID=13296017","興亞太節能科技股份有限公司",20250415
"堤諾義大利比薩Tino's Pizza Café-早班兼職 【台北信義101門市】<通過各級考核與加計工作獎金，時薪可達$200以上 >",全職,16,旅遊／餐飲／休閒,160207,餐飲服務及接待員,2,額滿為止,"要找份兼職工作歡迎排個時間聊聊!有的是好玩的夥伴，賺的是錢與開心~★彈性排班早班/假日班  都歡迎~讓您兼顧學業或家庭的兼差時段1.門市外場服務及管理學習、執行。2.門市內場廚房各項工作站技能學習、獨立作業。3.通過各級考核與加計工作獎金，時薪可達$200以上。我們在找 YOU  學習成長、規劃未來就是現在!!  其他條件個性活潑開朗，具備服務熱忱，歡迎加入我們團隊!",台北市信義區,無,日班,時薪,190,-,高中,"https://job.taiwanjobs.gov.tw/Internet/jobwanted/JobDetail.aspx?EMPLOYER_ID=1127296&HIRE_ID=13391029","商邦餐飲有限公司",20250306
"緯豆集團【點點心】採購專員",全職,15,物流／運輸／資材,150306,採購助理,1,額滿為止,"1️⃣ ERP系統操作（採購單建立、交貨與請款流程）2️⃣ 交期追蹤與請款進度管理3️⃣ 協助控管採購發包進度4️⃣ 具食品原料採購經驗佳★★ 歡迎細心、有責任感、數字邏輯佳的您加入我們 ★★ 工作技能供應商資料管理維護、商品採購作業、採購對帳作業",台北市信義區,3年以上,日班,月薪,33000,35000,專科,"https://job.taiwanjobs.gov.tw/Internet/jobwanted/JobDetail.aspx?EMPLOYER_ID=2260963&HIRE_ID=13507089","點點心股份有限公司",20250501
"(台北六福萬怡酒店)(無經驗可)服務中心 禮賓接待",全職,16,旅遊／餐飲／休閒,160205,飯店工作人員,2,額滿為止,"1. 迎賓並提供顧客旅遊及館內資訊。2. 協調安排客人之交通運輸服務。3. 運送客人行李進出房間與上下車。4. 執行個人服務，如專送旅客留言與包裹、接送客房差遺與提供客人商務資料。5. 遞送信件包裹與其他信函。6. 另有額外收入小費制度0-5000元不等。*歡迎應屆畢業生、社會新鮮人、二度就業重返友善職場喔。",台北市南港區,無,日班、夜班,月薪,34000,40000,不拘,"https://job.taiwanjobs.gov.tw/Internet/jobwanted/JobDetail.aspx?EMPLOYER_ID=2256623&HIRE_ID=13476397","六福開發股份有限公司南港分公司",20250415
"外場正職人員5/8",全職,16,旅遊／餐飲／休閒,160207,餐飲服務及接待員,5,20250508,"1.點餐服務、送餐服務2.甜點製作3.餐具碗盤洗滌4.協助餐廳環境清潔5.主管交辦事項【信義站5/8(四)14:00-16:00現場徵才活動】",台北市不限,無,輪班二班制,月薪,33000,38000,高職,"https://job.taiwanjobs.gov.tw/Internet/jobwanted/JobDetail.aspx?EMPLOYER_ID=152583&HIRE_ID=13509653","樂雅樂食品股份有限公司",20250430
"漢堡王服務員-全職人員[長春店]",全職,16,旅遊／餐飲／休閒,160207,餐飲服務及接待員,5,20250505,"外場作業:環境整潔櫃台作業:收銀作業/顧客服務內場作業:食品安全/材料準備/高品質餐點製作可配合彈性排班",台北市中山區,無,輪班三班制,月薪,29000,32000,高中,"https://job.taiwanjobs.gov.tw/Internet/jobwanted/JobDetail.aspx?EMPLOYER_ID=149530&HIRE_ID=13388029","台鋼漢堡王股份有限公司",20250305
"美語儲備主管",全職,01,經營／行政／總務,010105,儲備幹部,5,20250607,"1.美語課程規劃服務、課程招生業務及分校管理學習。2.可配合輪早午班及階段性跨區轉調(縣市)培訓者。3.歷練基層職務後轉門市店長職。**薪資之外 ，另依獎金制度發給獎金**",台北市不限,2年以上,日班、中班,月薪,30000,35000,大學,"https://job.taiwanjobs.gov.tw/Internet/jobwanted/JobDetail.aspx?EMPLOYER_ID=17048&HIRE_ID=13455311","巨匠電腦股份有限公司",20250407
"作業員",全職,11,營建／製圖／施作,110309,粗工,6,20250621,"1.營建廢棄物人工撿拾2.設備保養3.環境清潔整理",台北市松山區,無,日班,月薪,37000,-,不拘,"https://job.taiwanjobs.gov.tw/Internet/jobwanted/JobDetail.aspx?EMPLOYER_ID=699615&HIRE_ID=13491315","金茂榮環境工程有限公司",20250421
"測試工程師-",全職,09,品管／製造／環衛,090209,硬體測試工程師,6,20250630,"1.產品相容性品質測試驗證。2.作業系統安裝及功能驗證。3.產品功能性及穩定性測試。",台北市內湖區,無,日班,月薪,36000,50000,專科,"https://job.taiwanjobs.gov.tw/Internet/jobwanted/JobDetail.aspx?EMPLOYER_ID=211881&HIRE_ID=13457819","宜特科技股份有限公司",20250418
"新聞部新聞網執行製作",全職,13,傳播／娛樂／藝術,130108,節目製作人員,3,額滿為止,"1.處理上架YT影片，今日頭條影音影片2.對兩岸議題有興趣工作技能各式影片剪接後製作業其他條件1.具影片剪輯處理能力2.個性積極、勤奮、肯學習，能配合輪班3.具創意，有耐心處理繁雜工作事務",台北市內湖區,無,日班、夜班,月薪,30000,40000,專科,"https://job.taiwanjobs.gov.tw/Internet/jobwanted/JobDetail.aspx?EMPLOYER_ID=131439&HIRE_ID=13405135","中天電視股份有限公司",20250314
"機構設計工程師 (此為現場徵才活動職缺)",全職,07,工程／研發／生技,070204,機構工程師,2,20250519,"1.負責產品機構設計與結構評估。 2.負責模具檢討、誠模、修改。 3.負責各產品工程技術文件之製作。 4.負責BOM建立、更新及維護。 5.解決量產製造及製程中的機構相關問題。114年5月17日（六）「畢業季暨北市科技園區聯合招募活動」活動時間：114年5月17日（六）10：30 ～16：00 (請於15:30前入場)活動地點：臺北車站1樓車站大廳(臺北市中正區北平西路三號) 洽詢電話：02-2338-0277*****請親洽*****想要知道更多活動資訊詳情請查詢 https://okwork.gov.taipei",台北市內湖區,5年以上,日班,月薪,40000,-,專科,"https://job.taiwanjobs.gov.tw/Internet/jobwanted/JobDetail.aspx?EMPLOYER_ID=209183&HIRE_ID=13462543","南京資訊股份有限公司",20250409
"環境清潔",全職,19,清潔／家事／托育(保母),190104,環境清潔工,10,20250513,"#17◎◎◎家事員管理一般居家清潔打掃有無經驗均可",台北市不限,無,日班、中班,日薪,1700,2000,不拘,"https://job.taiwanjobs.gov.tw/Internet/jobwanted/JobDetail.aspx?EMPLOYER_ID=914303&HIRE_ID=13407109","總管家家事清潔有限公司",20250313
"粵菜餐廳 廚房學徒",全職,16,旅遊／餐飲／休閒,160206,廚師助理,1,額滿為止,"廚房備料※上班時段日班/晚班/假日班，10:00-21:00(視營業狀況彈性調整)(二段班)，需輪班",台北市不限,無,日班、夜班、輪班二班制,月薪,36000,38000,高中,"https://job.taiwanjobs.gov.tw/Internet/jobwanted/JobDetail.aspx?EMPLOYER_ID=2520227&HIRE_ID=13474203","漢來美食股份有限公司台北南港分公司",20250430
"【台北】【時薪190元】（半日、全日）PT小鹿輕食餐車服務員【路徒PLUS行旅站前館】@好玩、活力、成長、信任",全職,16,旅遊／餐飲／休閒,160205,飯店工作人員,2,額滿為止,"※此職缺可選擇 半日13-17時、或者全日8-17時，一週可配合3~5天者優先錄取1. 配合公司政策，在 Happy Hour 時段，製作簡易餐點（洋蔥圈、雞塊、可頌、冰淇淋等小點心）2. 食材製前準備，擺盤及食品裝飾3. 簡單招呼並引導旅客拿取餐點4. 細心觀察旅客用餐習慣，收集旅客反饋5. 維持工作環境整潔 6. 盤點食材庫存7. 其他主管交辦事項 小鹿文娛官網：https://fawn-group.com/路徒PLUS行旅官網：https://roadersplushotel.com/工作技能食物製前準備其他條件1. 具備餐飲製作經驗尤佳。2. 無相關經驗，但具餐飲製作與服務熱忱者亦可。3. 一週可配合3~5天者優先錄取，依一例一休排班，第6日上班給付加班費。",台北市中正區,1年以上,日班,時薪,190,-,高中,"https://job.taiwanjobs.gov.tw/Internet/jobwanted/JobDetail.aspx?EMPLOYER_ID=2391877&HIRE_ID=13502123","小鹿文娛股份有限公司",20250425
"辦公大樓清潔人員（內湖區基湖路）",全職,19,清潔／家事／托育(保母),190101,大樓及辦公室清潔員,2,20250618,"1. 辦公室清潔2. 執行其它清潔相關交辦事項。",台北市內湖區,無,日班,月薪,30000,32000,不拘,"https://job.taiwanjobs.gov.tw/Internet/jobwanted/JobDetail.aspx?EMPLOYER_ID=2392531&HIRE_ID=13485995","淞美清潔有限公司",20250418
"Android App Developer（此為現場徵才活動職缺）",全職,08,資訊／軟體／系統,080205,通訊軟體工程師,2,20250519,"114年5月17日（六）「畢業季暨北市科技園區聯合招募活動」活動時間：114年5月17日（六）10：30 ～16：00 (請於15:30前入場)活動地點：臺北車站1樓車站大廳(臺北市中正區北平西路三號) 洽詢電話：02-2338-0277*****請親洽*****想要知道更多活動資訊詳情請查詢 https://okwork.gov.taipei1.使用Kotlin開發語言進行開發與維護：負責使用Kotlin開發和維護現有的Android應用程式，確保應用在Google Play上的正常運行與更新2.優化產品頁行為互動設計：針對應用中的產品頁，進行用戶行為和互動設計的優化，提升用戶體驗，包括實現更直觀的互動元素、動畫效果和信息呈現方式3.實作符合UX的App前端設計：負責實現符合用戶體驗的App前端設計，確保操作流暢、界面友好，同時支持多種屏幕尺寸和設備4.註冊會員身份級別卡控規則實施：根據新增加的會員身份級別卡控規則，負責開發和實施相關功能，包括會員身份驗證、權限管理及級別特權等功能，確保會員系統的穩定性和安全性5.配合PM並參與團隊合作：與產品經理（PM）、設計師和後端工程師密切合作，負責前後端需求對接，通過API實現功能串接，同時收集並分析相關數據，持續優化應用功能6.前端程式碼撰寫與效能優化：負責行動裝置的App前端代碼撰寫，並進行性能優化，提高頁面的加載速度和使用流暢度7.系統維護與升級：對已有系統進行定期維護，解決技術問題並進行必要的升級，確保應用程序的穩定性和安全性",台北市內湖區,無,日班,月薪,40000,-,大學,"https://job.taiwanjobs.gov.tw/Internet/jobwanted/JobDetail.aspx?EMPLOYER_ID=823114&HIRE_ID=13450283","雄獅資訊科技股份有限公司",20250402
"外場/正職(蜀川香酸菜魚)【公司符合職場支持輔導計畫】",全職,16,旅遊／餐飲／休閒,160207,餐飲服務及接待員,2,20251231,"1)迎賓帶位、菜單介紹、協助點餐與商品銷售服務。 2)跑單、擺盤、送餐及聯繫內外場服務。 3)於客人用餐完畢後，負責收拾碗盤與清理環境。 4)協助進行簡易餐飲料理，如：調配飲料、製作甜點等。 5)桌邊服務、結帳及POS機收銀等服務。 6)主管交辦事項。",台北市中山區,無,日班、夜班,月薪,33000,-,高中,"https://job.taiwanjobs.gov.tw/Internet/jobwanted/JobDetail.aspx?EMPLOYER_ID=2510425&HIRE_ID=13262435","米塔泰舍股份有限公司",20250306
"財務助理",全職,04,財務／金融／保險,040109,財務專業人員,1,額滿為止,"1.現場財報製作送審2.一般行政財務事務",台北市中正區,2年以上,日班,月薪,38000,42000,專科,"https://job.taiwanjobs.gov.tw/Internet/jobwanted/JobDetail.aspx?EMPLOYER_ID=86855&HIRE_ID=13493191","喬信公寓大廈管理維護有限公司",20250422
"堤諾Tino's Pizza Café【連鎖餐飲集團 儲備幹部】濟南門市★薪資33K~37K★供員餐",全職,16,旅遊／餐飲／休閒,160207,餐飲服務及接待員,2,額滿為止,"【工作內容】1.餐飲製作及品質標準維持。2.餐飲銷售及服務。3.硬體設備維護及門市環境清潔整理。4.門店營運管理，門店夥伴訓練。5.遵照服務流程，提供客人專業、即時的服務。6.主動關心、照顧客人，給予客人難以忘懷的用餐體驗服務。7.學習團隊合作，達成團隊目標！上班時段日班/晚班/假日班，11:00~21:00 (休息兩小時)其他條件對餐飲及服務工作有熱忱！",台北市中正區,無,日班、夜班,月薪,33000,37000,高中,"https://job.taiwanjobs.gov.tw/Internet/jobwanted/JobDetail.aspx?EMPLOYER_ID=1127296&HIRE_ID=13390373","商邦餐飲有限公司",20250306
"人事專員",全職,03,人資／法務／智財,030102,人力資源專員,3,20250620,"1. 人員招募、甄選與任用之規劃與執行。2. 考核績效，教育訓練等勞資問題處理。3. 薪酬管理、人員出勤、勞健保申報之處理與執行。4. 人事管理規章訂定，人事系統操作。",台北市中正區,1年以上,日班,月薪,32000,45000,大學,"https://job.taiwanjobs.gov.tw/Internet/jobwanted/JobDetail.aspx?EMPLOYER_ID=2375243&HIRE_ID=13490761","富達欣業股份有限公司",20250421
"漢堡王服務員-兼職人員[兒童新樂園店]",全職,16,旅遊／餐飲／休閒,160207,餐飲服務及接待員,5,20250610,"外場作業:環境整潔櫃台作業:收銀作業/顧客服務內場作業:食品安全/材料準備/高品質餐點製作早班、中班、晚班 可配合彈性排班",台北市士林區,無,輪班三班制,時薪,190,200,高職,"https://job.taiwanjobs.gov.tw/Internet/jobwanted/JobDetail.aspx?EMPLOYER_ID=149530&HIRE_ID=13468317","台鋼漢堡王股份有限公司",20250410
"【乾杯信義區】乾杯信義ATT店 兼職店員 時薪最高270【中班/假日中班 12:00-21:00 】A08P4",全職,16,旅遊／餐飲／休閒,160207,餐飲服務及接待員,5,額滿為止,"【薪　　資】 無經驗起：起薪190元 (含10元PT津貼為200元)有經驗　：起薪210元 (含10元PT津貼為220元)視經驗調整起薪，最高可達270元(含10元津貼)【工作內容】內場店員：擺盤傳菜、食材準備、食材調理、廚房清理及維護環境、主管交辦事項等。外場店員：接待及引導、餐點酒水介紹、協助顧客點餐、桌邊服務及維護環境。 主管交辦事項等。 依照學習狀況習得技能加薪【工作需求】 12:00-21:00 中班 / 假日中班每週排班，可彈性調整",台北市信義區,無,中班,時薪,190,270,高中,"https://job.taiwanjobs.gov.tw/Internet/jobwanted/JobDetail.aspx?EMPLOYER_ID=933158&HIRE_ID=13423983","乾杯股份有限公司",20250320
"",全職,06,客服／門市,060203,專櫃／門市（人員／儲備幹部）,5,20250518,"於專櫃、賣場或店面門市內提供商品介紹及銷售服務。",台北市大安區,無,日班、中班,月薪,33000,35000,高中,"https://job.taiwanjobs.gov.tw/Internet/jobwanted/JobDetail.aspx?EMPLOYER_ID=2547919&HIRE_ID=13416577","豫銘商行",20250318
