OCCU_DESC,WK_TYPE,CJOB1_COUNT,CJOB_NAME1,CJOB2_COUNT,CJOB_NAME2,JOB_PERSON,STOP_DATE,JOB_DETAIL,CITYNAME,EXPERIENCE,WKTIME,SALARYCD,NT_L,NT_U,EDGRDESC,URL_QUERY,COMPNAME,TRANDATE
"兼職人員",全職,22,其他職類,220101,兼職人員,10,額滿為止,"內場兼職-1.麵食、麵點、炒台類產品製作即出餐品質控管。2.廚房環境衛生與清潔維護。3.協助備品收納和食材收貨整理。外場兼職-1負責帶位、點餐及送餐。2.收拾清潔碗盤、整理桌面及周邊環境。3.外帶/外送餐點打包及品項確認。工作時段09:00~22:00時段內排班，每次至少排班4小時",台北市不限,無,日班、中班,時薪,195,-,不拘,"https://job.taiwanjobs.gov.tw/Internet/jobwanted/JobDetail.aspx?EMPLOYER_ID=1081723&HIRE_ID=13464609","漢記股份有限公司",20250430
"就業服務員",全職,01,經營／行政／總務,010206,行政助理,1,20250514,"辦理勞動部「補助地方政府辦理身心障礙者支持性就業服務計畫」相關業務及其他交辦事項等。",台北市萬華區,無,日班,月薪,36180,36180,高中,"https://job.taiwanjobs.gov.tw/Internet/jobwanted/JobDetail.aspx?EMPLOYER_ID=1151189&HIRE_ID=13507259","臺北市勞動力重建運用處",20250429
"【杏子豬排】台北凱撒店-內外場儲備幹部",全職,16,旅遊／餐飲／休閒,160207,餐飲服務及接待員,3,20250503,"↗外場服務夥伴↙1. 餐桌佈置及整潔服務2. 顧客接待及座位安排3. 回覆顧客點餐需求與提供建議4. 提供顧客桌邊服務5. 內場廚房支援備料6. 整潔門市環境與餐具保養↗內場服務夥伴↙1.負責洗、剝、削、切各種食材，以完成烹飪的前置工作2.協助廚師測量食材的容量與重量3.分切流程作業4.食材分裝分包",台北市中正區,無,日班、夜班,月薪,35000,40000,高中,"https://job.taiwanjobs.gov.tw/Internet/jobwanted/JobDetail.aspx?EMPLOYER_ID=2311647&HIRE_ID=13375129","王座國際餐飲股份有限公司",20250303
"『最高時薪270元！』信義區計時社員聯合募集-KCLD1",全職,16,旅遊／餐飲／休閒,160207,餐飲服務及接待員,5,額滿為止,"【薪　　資】 無經驗    ：起薪190元 (含10元PT津貼為200元)有經驗　：起薪210元 (含10元PT津貼為220元)視經驗調整起薪，最高可達270元(含10元津貼)【工作內容】內場店員：擺盤傳菜、食材準備、食材調理、廚房清理及維護環境、主管交辦事項等。外場店員：接待及引導、餐點酒水介紹、協助顧客點餐、桌邊服務及維護環境。 主管交辦事項等。 依照學習狀況習得技能加薪【工作需求】 9:00~00:00 區間排班；每週排班，可彈性調整",台北市信義區,無,日班、夜班,時薪,190,270,高中,"https://job.taiwanjobs.gov.tw/Internet/jobwanted/JobDetail.aspx?EMPLOYER_ID=933158&HIRE_ID=13425223","乾杯股份有限公司",20250320
"『最高41.5K』老乾杯 SOGO復興店-外場店員 多元獎金等你拿C12D1",全職,16,旅遊／餐飲／休閒,160207,餐飲服務及接待員,5,額滿為止,"【薪　　資】本薪33000元+MASTER津貼3500元=36500元獎金另計，最高可達41500元。以上薪資不含加班費。加班費另計。【工作內容】外場工作：接待及引導、餐點酒水介紹、協助顧客點餐、桌邊服務及維護環境。 主管交辦事項等，依照學習狀況習得技能加薪。【工作需求】班別分為：早、中、晚班每週排休兩天，每週排班，國定假日可再額外排休",台北市大安區,無,日班、夜班、中班,月薪,33000,41500,專科,"https://job.taiwanjobs.gov.tw/Internet/jobwanted/JobDetail.aspx?EMPLOYER_ID=933158&HIRE_ID=13417535","乾杯股份有限公司",20250320
"【M One Café-信義A11】內場服務人員-月薪34，000～43，000",全職,16,旅遊／餐飲／休閒,160202,中/西餐烹飪廚師,3,20331231,"1. 依照標準SOP，執行菜口、炒台、煎台各工作站之職務。2. 確保餐點品質符合食品安全衛生與製餐流程。3. 維持工作區域的環境整潔。4. 食材進貨整理及存量控制。5. 從基層培育為營運幹部，學習管理內場事務及營運管理，共同達成團隊目標。為了讓夥伴更容易融入，入職後我們替你做到：保證有專屬老師帶領你完整的訓練流程，也有店長固定時間的關心，同事的互相關懷更不可少！【員工福利】(1)保險項目 : 團保(2)休假制度 : 月排休8-10天(年度例休及國定假日)(3)員工福利 ※獎金福利 : 全勤獎金、年終獎金、班別津貼、語言津貼※健康福利 : 年度健康檢查※旅遊福利 : 年度員工海內外旅遊※生日福利 : 生日禮券※節慶福利 : 年度大型春酒活動※其他福利 : 供膳、員工制服、員工消費折扣※福委福利 : 中秋禮金(禮盒) 、端午禮金及肉粽、聚餐活動、                       每年不定期發放電影票或消費禮券(4)教育訓練 ※新人訓練 : 新進職前訓練※在職訓練 : 1.在職訓練 2.公費外部訓練3.管理職能 4.語言能力除了認真工作，我們也認真玩樂！2019年疫情前最後一國外員工旅遊我們去＿越南＿，疫情期間台灣走透透！平時認真工作，員工活動認真獎勵，是我們M One Café 的傳統。M One Café誠摯歡迎對內場職務 具有興趣、熱忱、喜歡團隊合作的您加入。只要您具備 責任感、適應力強、抗壓性佳，快來成為我們享受工作的夥伴吧！",台北市信義區,無,,月薪,34000,43000,高中,"https://job.taiwanjobs.gov.tw/Internet/jobwanted/JobDetail.aspx?EMPLOYER_ID=2336843&HIRE_ID=12232115","橘色涮涮屋火鍋店",20230906
"(PT)餐廳-洗碗員",兼職,16,旅遊／餐飲／休閒,160208,廚務清潔員,2,20251231,"負責廚房餐具、碗盤洗滌工作。 ",台北市松山區,無,日班、夜班、部份工時：時分至時分,時薪,200,-,不拘,"https://job.taiwanjobs.gov.tw/Internet/jobwanted/JobDetail.aspx?EMPLOYER_ID=2308605&HIRE_ID=13466165","文華精品股份有限公司",20250430
"證券營業員",全職,04,財務／金融／保險,040206,證券營業員,3,20250617,"幫助客戶買賣股票、債券、基金、期貨等金融產品，且根據客戶的財務狀況和需求，提供量身定制的財務規劃和投資建議。",台北市中山區,無,日班,月薪,30000,40000,大學,"https://job.taiwanjobs.gov.tw/Internet/jobwanted/JobDetail.aspx?EMPLOYER_ID=2564067&HIRE_ID=13484267","永豐金證券中正分公司",20250417
"辦公室清潔員",全職,19,清潔／家事／托育(保母),190101,大樓及辦公室清潔員,2,額滿為止,"辦公室環境、廁所清潔打掃。中午休息11:30-13:30",台北市士林區,無,日班,月薪,30000,32000,不拘,"https://job.taiwanjobs.gov.tw/Internet/jobwanted/JobDetail.aspx?EMPLOYER_ID=2566629&HIRE_ID=13483981","玖富國際有限公司",20250417
"房務組-房務員",全職,16,旅遊／餐飲／休閒,160105,房務員,2,20250616,"1.負責客房的清潔與保養工作。2.客房備品接收與發送。 3.協助客房備品管控與耗損。4.公共區域清潔工作。5.其他主管交辦事項。",台北市南港區,無,日班、夜班、輪班三班制、中班,月薪,32000,-,高中,"https://job.taiwanjobs.gov.tw/Internet/jobwanted/JobDetail.aspx?EMPLOYER_ID=2519099&HIRE_ID=13480957","漢來國際飯店股份有限公司台北分公司",20250430
"金融通路營業部－辦事員/專員",全職,01,經營／行政／總務,010206,行政助理,2,20250607,"1. 銀行通路業務維護2. 通路業務績效報表製作3. 通路簽署文件整理",台北市中正區,無,日班,月薪,33000,-,大學,"https://job.taiwanjobs.gov.tw/Internet/jobwanted/JobDetail.aspx?EMPLOYER_ID=86161&HIRE_ID=13456055","兆豐產物保險股份有限公司",20250430
"一条通-內場兼職人員【台北】",兼職,16,旅遊／餐飲／休閒,160206,廚師助理,10,20250528,"1、各類餐點製作、出餐品質控管。2、內場環境清潔，遵守環境衛生規範。3、庫存盤點。",台北市中山區,無,輪班二班制、部份工時：時分至時分,時薪,195,-,不拘,"https://job.taiwanjobs.gov.tw/Internet/jobwanted/JobDetail.aspx?EMPLOYER_ID=2387965&HIRE_ID=13446191","誠邦食品股份有限公司",20250407
"居家照顧服務員",兼職,17,醫療／美容／保健,170113,照顧服務員,15,20250525,"長照居家服務B碼服務。身體清潔、餐食照顧、協助沐浴、肢體關節運動、陪同外出、代購…等。",台北市士林區,無,日班、部份工時：時分至時分,時薪,200,250,不拘,"https://job.taiwanjobs.gov.tw/Internet/jobwanted/JobDetail.aspx?EMPLOYER_ID=2395673&HIRE_ID=13432565","臺北市私立跑居家長照機構",20250325
"誠徵早晚班/假日班工讀生※過學習期時薪$210起※☆三大獎金☆無經驗可☆",全職,16,旅遊／餐飲／休閒,160207,餐飲服務及接待員,1,額滿為止,"負責餐飲場所的內外場事務、顧客菜單諮詢、點餐供餐及環境清潔。☀️工作內容：1. 煮茶備料2. 點餐3. 調製飲料4. 店內清潔👍🏻須能獨當一面👍🏻刻苦耐勞、認真負責、親和力佳👍🏻手腳俐落、抗壓性佳👍🏻調薪＋獎金制度👍🏻學習期間$190/H，正式上線$210/H起可到職日：即時上班時間：16:00-22:00或17:00-22:00 或 17:30-22:00可選擇只上晚班或早晚輪班(含假日)，適合時間彈性的求職者。享勞健保尾牙/春酒聚餐三節禮金全勤獎金營業獎金年終獎金員工福利🌸🌸須長期配合，短期勿試🌸🌸⛔️⛔️不接受只應徵寒暑假⛔️⛔️歡迎✅二度就業✅交換學生（需能中文溝通）一起加入冰饌紅茶粉圓的行列喔🤗",台北市信義區,無,日班、夜班,時薪,190,250,不拘,"https://job.taiwanjobs.gov.tw/Internet/jobwanted/JobDetail.aspx?EMPLOYER_ID=2565945&HIRE_ID=13480415","淳品商行",20250428
"★☆★2025年中盛大開幕★☆★【點點心-ATT信義店】高級服務專員~(月薪34000元起) ✦另享最高【$2,640元】出勤獎勵金✦",全職,16,旅遊／餐飲／休閒,160207,餐飲服務及接待員,5,額滿為止,"1. 執行桌邊及餐食服務，如倒水、點菜、送菜、撤桌..等工作。2. 負責開餐前準備工作，補齊工作站內之餐具及備品。3. 維持負責區域之整潔，以提供顧客舒適乾淨的用餐環境。 4. 其他主管交辦事項。5. 無經驗可、願接受全新培訓，可配合輪班者。★☆ 每月出勤時數達65小時以上，且符合出勤規範標準者，每小時額外加發【$15元】出勤獎勵金，每月最高可領【$2,640元】。『例如』當月份沒有請/休假，每月正常出勤時數應為176小時，核發獎勵金為：$15元ｘ176小時= $2,640元；如有加班，另計。------------------------------------------------------------------------※開幕前，將安排您至鄰近的門市受訓※※預計2025年中盛大開幕！其他條件★經面試錄取，報到需繳交餐飲業(供膳檢查)體檢合格報告。",台北市信義區,無,日班、夜班,月薪,34000,-,高中,"https://job.taiwanjobs.gov.tw/Internet/jobwanted/JobDetail.aspx?EMPLOYER_ID=2260963&HIRE_ID=13509021","點點心股份有限公司",20250501
"運輸安全專員",全職,09,品管／製造／環衛,090301,職業安全衛生管理員,1,額滿為止,"年度運輸承攬商安全管理計畫運輸承攬商安全教育訓練查核運輸承攬商運輸設備維護查核運輸承攬商運輸相關作業程序查核運輸承攬商車輛事故調查處理運輸承攬商客訴及異常事件管理運輸承攬商緊急應變規劃年度運輸承攬商安全稽核運輸承攬商安全指標彙整與分析運輸承攬商司機工時檢討管理運輸承攬商每季司機行為評估結果彙整處理運輸承攬商車輛監控查核出差外派需出差，一年累積時間約一個月以下工作技能執行安全衛生督導及稽核、擬定各項安全衛生管理辦法、工作安全與環保衛生、規劃督導安全衛生設施之檢點與檢查",台北市南港區,3年以上,日班,依學經歷、證照核薪(每月經常性薪資達4萬元以上),-,-,大學,"https://job.taiwanjobs.gov.tw/Internet/jobwanted/JobDetail.aspx?EMPLOYER_ID=125323&HIRE_ID=13486853","聯華氣體工業股份有限公司",20250421
"關懷訪視服務",全職,14,教育／學術／研究,140120,社工人員,1,額滿為止,"1.個案家庭輔助服務 / 醫護訪視 / 心理諮商資源連結2辦理班級衛教-進行適學輔導-個案就學輔導、生涯轉銜 專業知能研習、校園生命教育宣導3.輔導計畫提案 ， 執行及結案 ， 成果核銷 (工作團隊分工合作執行)我們需要:  有樂於助人熱誠的心 及 不怕困難行動力 ， 愛心耐心對待特別的兒童.青少年...成為腦瘤家庭的好朋友我們重視團體合作  尊重每位員工的專才及理想  找尋願意一起努力創造更多可能",台北市北投區,無,日班,月薪,32000,35000,大學,"https://job.taiwanjobs.gov.tw/Internet/jobwanted/JobDetail.aspx?EMPLOYER_ID=523577&HIRE_ID=13451961","中華民國關懷腦瘤兒童協會",20250402
"《月薪40，000元↑》【日商壽司郎】台北中華路店-正職人員★歡迎二度就業、無經驗者★",全職,16,旅遊／餐飲／休閒,160207,餐飲服務及接待員,10,20250930,"﹌透過美味的壽司，將幸福傳遞下去﹌うまいすしを、腹一杯。うまいすしで、心も一杯。年年調薪、福利最多，歡迎對餐飲業有熱忱的你！⭕獎金福利【優良勤務津貼】每月優良勤務津貼(最高2，000元)【三節獎金】定額獎金、春酒抽獎活動【競賽獎金】每月店鋪競賽活動獎金【介紹獎金】介紹親朋好友入職，期滿可獲得3，000~10，000元獎金【輪調津貼】配合外縣市輪調者，皆享租屋津貼補助【其他津貼】結婚生育津貼、喪葬慰問金、生日禮券、生日假、在職進修、年度健檢津貼、員工用餐優惠【夏、冬季獎金】一年兩次獎金發放（幹部限定福利，依公司營運狀況及職等考核調整）⭕職位發展（實力主義不論年資，店長年薪百萬）【年薪1，330，000】區經理【年薪1，060，000】店長【年薪770，000】副店長【年薪640，000】主任▪以上最高年薪預估僅含夏、冬季獎金，尚未包含他項獎金或津貼▪新進正職人員月薪40，000元起（內含特殊獎金），每年兩次考核⭕工作內容（在職教育訓練完善，無經驗者OK）▪外場帶客入座→用餐說明、顧客服務→桌面清潔→環境整理→收銀結帳 等▪內場商品進貨→食材處理→餐點製作→餐具清洗→環境整理→庫存盤點 等⭕工作時間▪需配合08:30~24:00輪班（每日排班8小時）▪月休天數：公司依照人事行政局訂定每月紅字日數排休⭕企業魅力▪加班費為5分鐘為單位計算，重視員工的辛勤付出。▪實力主義不論年資，且制度完善、升遷調薪快速，適合具有企圖心的您。▪學習日系企業商業禮儀、餐飲相關專業技能，並能接觸店舖經營管理。▪展店計畫涵蓋全台灣，目標成為台灣第一迴轉壽司品牌。▪傾聽員工訴求，共同打造「以人為本」的舒適工作環境。",台北市中正區,無,,月薪,40000,42500,不拘,"https://job.taiwanjobs.gov.tw/Internet/jobwanted/JobDetail.aspx?EMPLOYER_ID=2370831&HIRE_ID=13269857","台灣壽司郎股份有限公司",20250307
"照顧服務員",兼職,17,醫療／美容／保健,170113,照顧服務員,20,20250609,"配合長照2.0，提供個案居家照顧服務(身體日常照顧、家務協助等)及喘息、短照服務",台北市士林區,無,部份工時：時分至時分,時薪,200,450,不拘,"https://job.taiwanjobs.gov.tw/Internet/jobwanted/JobDetail.aspx?EMPLOYER_ID=2486381&HIRE_ID=13461577","臺北市私立樂陽居家長照機構",20250409
"實習生(0506&0515校徵)",全職,22,其他職類,220101,兼職人員,10,20250621,"◎◎◎#061.顧客服務與門市環境清潔2.飲品調製與咖啡文化推廣3.商品銷售與行銷活動執行",新北市不限,無,日班、夜班,時薪,190,190,不拘,"https://job.taiwanjobs.gov.tw/Internet/jobwanted/JobDetail.aspx?EMPLOYER_ID=3893&HIRE_ID=13489833","悠旅生活事業股份有限公司",20250421
"文華東方酒店正職客房餐飲服務員",全職,16,旅遊／餐飲／休閒,160207,餐飲服務及接待員,20,20250518,"•遞送迎賓贈禮至客房•負責客房的餐飲相關需求(點餐、收送餐點)•文書處理如結帳、對帳及印報表•具備餐飲方面的相關知識•接聽電話點餐並有效率地與廚房聯繫取餐",台北市松山區,無,輪班二班制,月薪,36000,-,專科,"https://job.taiwanjobs.gov.tw/Internet/jobwanted/JobDetail.aspx?EMPLOYER_ID=1162806&HIRE_ID=13416501","開泰豐國際股份有限公司",20250318
"通路業務",全職,02,業務／貿易／銷售,020102,業務人員,1,額滿為止,"工作內容：●  通路經營策略規劃與執行(1)依品牌發展進行通路策略規劃及開發(KA/區域性)(2)通路客情維繫(3)通路販促活動安排及執行(4)通路行銷活動/異業合作洽談與執行(5)業績達成對策(6)數字分析及檢討(業績/庫存/產品)●  專案規劃與執行●  跨部門工作溝通與協調●  工作報告彙整製作其餘主管交辦事項",台北市南港區,無,日班,月薪,35000,50000,大學,"https://job.taiwanjobs.gov.tw/Internet/jobwanted/JobDetail.aspx?EMPLOYER_ID=651467&HIRE_ID=13407291","超能生化科技股份有限公司台東分公司初鹿牧場",20250313
"聖德科斯生機-台北市門市人員",全職,06,客服／門市,060203,專櫃／門市（人員／儲備幹部）,10,20250629,"聖德科斯生機連鎖門市為統一企業子公司 我們販售美好的生機生活 希望顧客在第一時間採買到 最新鮮、最原味的健康食材 　 我們正在尋找這樣的你 ✔喜歡與客人互動 ✔熱愛服務與銷售 ✔樂於接受挑戰 ✔願配合排班、排休、調動 如果你覺得：沒錯！這就是我！ 歡迎你投遞履歷加入我們 　 工作內容:1.門市環境清潔維護。 2.認識門市商品擺放位置與商品上架流程。 3.學習商品相關資料。 4.門市前台POS結帳操作與後台訂貨作業。 5.門市附近商圈經營與客人服務。6.其他庶務性事務。  ",台北市不限,無,日班、夜班、輪班三班制、中班,月薪,31000,31000,高中,"https://job.taiwanjobs.gov.tw/Internet/jobwanted/JobDetail.aspx?EMPLOYER_ID=32461&HIRE_ID=13506519","統健實業股份有限公司",20250429
"內湖日夜機動保全",全職,18,保全／軍警消,180101,保全人員,2,20250614,"從事巡邏、守衛，以及安全維護等工作。",台北市內湖區,無,日班、夜班,月薪,38000,38000,不拘,"https://job.taiwanjobs.gov.tw/Internet/jobwanted/JobDetail.aspx?EMPLOYER_ID=60021&HIRE_ID=13473301","天辰保全股份有限公司",20250414
"門市儲備店經理",全職,06,客服／門市,060203,專櫃／門市（人員／儲備幹部）,1,20250601,"1.	外場服務-接待與引導顧客入座、餐點介紹、點餐收銀。2.	內場職能-壽司捏製、湯品製作，甜點、飲品準備、出餐品質管理。3.	顧客關係經營-對服務經營有熱誠，喜歡與顧客互動拉近距離，提升服務滿意度。	4.	顧客關係經營與維護-主動關心客人拉近與顧客的距離，提升服務滿意度。5.	優化門市作業流程-維持門市整潔、硬體維護與其他庶務協助。6.	門市營運管理-人事值班管理、財務成本控管、營業績效管理、員工人力發展及教育訓練執行。7.     10:00~22:00(每日排班8小時)",台北市不限,無,,月薪,39800,46300,專科,"https://job.taiwanjobs.gov.tw/Internet/jobwanted/JobDetail.aspx?EMPLOYER_ID=3416&HIRE_ID=13446087","爭鮮股份有限公司",20250407
"外語企劃專案執行人員",全職,02,業務／貿易／銷售,020102,業務人員,2,20250510,"規劃特色遊程進行考察行銷及推廣出入境業務，達成專案合作目標。",台北市中山區,無,日班,月薪,31000,33000,專科,"https://job.taiwanjobs.gov.tw/Internet/jobwanted/JobDetail.aspx?EMPLOYER_ID=93816&HIRE_ID=13398111","行家旅行社股份有限公司",20250310
"【點點心-研發部】中廚研發主廚~(月薪55000~70000元)",全職,16,旅遊／餐飲／休閒,160202,中/西餐烹飪廚師,1,額滿為止,"1. 了解點心(中式點心)的食材、製作的方法並具實作經驗。2. 配合廚務總監，進行中式點心菜色研發與製作。3. 具有工作安全的觀念，並需維持最高的衛生品質。4. 烹煮員工餐食。5. 因應營運需要，可配合其他支援與輪班。6. 其他主管交辦事項。工作技能廚房設備維護管理、食物製前準備、食材成本控制其他條件★經面試錄取，報到需繳交餐飲業(供膳檢查)體檢合格報告。★具餐飲證照者佳。",台北市信義區,5年以上,日班,月薪,55000,70000,高中,"https://job.taiwanjobs.gov.tw/Internet/jobwanted/JobDetail.aspx?EMPLOYER_ID=2260963&HIRE_ID=13509187","點點心股份有限公司",20250501
"人資專員 (人才發展)",全職,03,人資／法務／智財,030102,人力資源專員,1,額滿為止,"-	前測、分析、規劃、回饋、執行、評估聯華氣體集團高階主管發展與接班人計畫。-	選拔、前測、分析、規劃、回饋、執行、評估聯華氣體集團中階人力發展與接班人計畫。-	擔任公司人才加速發展計畫專案經理：TFF飛翔計劃。-	負責公司High Potential選材，擬定發展計劃：Focus Group與 Level 1成員。-	協助並與主管討論：標的選材 Target Selection，與測評中心 Assessment Center 於人才發展計劃中的運用。-	參與、協助工務部生產廠廠長改造養成計劃。-	參與、協助接班人計劃與人才加速發展計劃。-	參與、協助年度專案計劃。-	協助高階主管之秘書、行政工作。-	協助一般員工績效考核表之收發。-	協助外籍藍領勞工之申請與簽核。-	主管臨時交付之其他任務。出差外派需出差，一年累積時間約一個月以下工作技能具備人力資源相關知識、招募任用制度設計、執行日常招募業務、績效與薪酬管理、文件收發與檔案管理、文書處理╱排版能力、行政事務處理、文件或資料輸入建檔處理、文件檔案資料處理、轉換及整合工作、勞工保險相關法規其他條件-	大學以上畢業，主修人力資源、心理、社會(工)、商學、企管等。-	人力資源員工培訓相關工作經驗三年以上，具人才發展、接班人計劃經驗尤佳。-	具備跨文化與跨領域之溝通經驗值，具跨國企業任職經驗者尤佳。-	精通Excel (函數、公式、圖表、排序、樞紐分析等)，具TQC-OA-Excel證照尤佳。-	熟悉中華民國勞動相關法令尤佳。-	英語聽、說、讀、寫佳。",台北市南港區,3年以上,日班,月薪,35000,-,大學,"https://job.taiwanjobs.gov.tw/Internet/jobwanted/JobDetail.aspx?EMPLOYER_ID=125323&HIRE_ID=13481697","聯華氣體工業股份有限公司",20250421
"照顧服務員",全職,17,醫療／美容／保健,170113,照顧服務員,2,20250610,"1.活動帶領及教案撰寫 2.協助長輩沐浴服務 3.個案活動參與紀錄撰寫 4.監測個案生命徵象 5.長輩日常生活照顧 6.餐食準備 7.工作區域清潔",台北市北投區,無,日班,月薪,32000,35000,不拘,"https://job.taiwanjobs.gov.tw/Internet/jobwanted/JobDetail.aspx?EMPLOYER_ID=2502457&HIRE_ID=13465841","財團法人伊甸社會福利基金會附設臺北市私立頤福社區式長期照顧服務機構",20250410
"商業數據分析師(0506校徵)",全職,21,行銷／企劃／專案,210105,市場調查/市調分析,2,20250621,"#03★◎1.規劃以「數據驅動」為主之商業解決方案，並與跨部門業務合作，扮演企業內部顧問角色，推動銀行數據創新轉型，其應用場景橫跨消法金領域與不同金融產品支線，例如：個人化產品推薦、客群經營建設與企金即時風險預警……等2.能清楚識別銀行業務情境及明確定義商業問題，運用結構化或非結構化資料之進行基礎數據探索與分析，並能跨公司、跨部門與跨團隊進行合作與討論，打造數據驅動解決方案3.具備敏捷思維，能運用不同專案管理手法或方式推動數據專案，並能協助判斷解決方案的可行性與落地性，有效達成組織任務",台北市信義區,無,日班,月薪,40000,40000,大學,"https://job.taiwanjobs.gov.tw/Internet/jobwanted/JobDetail.aspx?EMPLOYER_ID=10634&HIRE_ID=13491275","國泰世華商業銀行股份有限公司",20250421
"辦公室清潔人員(北投)",兼職,19,清潔／家事／托育(保母),190101,大樓及辦公室清潔員,1,20250510,"維持辦公室清潔，環境單純",台北市北投區,無,部份工時：13時00分至18時30分,部分工時(月薪),20000,21000,不拘,"https://job.taiwanjobs.gov.tw/Internet/jobwanted/JobDetail.aspx?EMPLOYER_ID=933456&HIRE_ID=13497317","太清潔有限公司",20250423
