OCCU_DESC,WK_TYPE,CJOB1_COUNT,CJOB_NAME1,CJOB2_COUNT,CJOB_NAME2,JOB_PERSON,STOP_DATE,JOB_DETAIL,CITYNAME,EXPERIENCE,WKTIME,SALARYCD,NT_L,NT_U,EDGRDESC,URL_QUERY,COMPNAME,TRANDATE
"VASA 瓦薩美式餐廳-【連鎖餐飲集團 店經理】★薪資45K~55K★供員餐",全職,06,客服／門市,060205,連鎖店管理人員,1,額滿為止,"【職務內容】 1.成本控管：包括人力成本、營運成本、協助內場的食材控管等。 2.外場管理：確保分店在符合公司文化及精神下正常運作。 3.教育訓練：針對新進人員及外場服務人員進行不定期教育訓練、以使工作人員達到最高標準的服務及表現。 4.危機問題反應及處理。 5.公司內部及外部的溝通管道及對內的上下溝通能力。6.需有曾擔任一家連鎖店以上企業的內部主管經驗。7.餐廳現場經營營運管理，外場sop服務流程執行。【工作內容】1.店舖管理、營運2.富有觀察力，能理性處理客戶訴求，解決問題3.具備門市行政管理、財務作業、及成本控管等基礎知識4.管理及教育員工，擅長溝通協調 5.具有餐飲管理工作經歷管理責任：管理5-8人其他條件1.工作態度認真，且積極負責。2.喜歡與人群互動！3.熱衷於團隊活動，能與夥伴們溝通，達成團隊目標！4.二年以上相關管理經驗",台北市內湖區,2年以上,日班、夜班,月薪,45000,55000,不拘,"https://job.taiwanjobs.gov.tw/Internet/jobwanted/JobDetail.aspx?EMPLOYER_ID=1127296&HIRE_ID=13391145","商邦餐飲有限公司",20250306
"旅行社OP人員",全職,16,旅遊／餐飲／休閒,160108,OP／旅行社人員,1,額滿為止,"需具旅行社經驗1.需使用科威系統 2.團體機票機位控管作業 3.參團人數彙整 、旅客證照 4.帶團領隊業務交班聯繫 5. 辦理旅客旅遊保險6. 國內外機票、車票訂位及開票7.協助辦理護照及各國簽證其他條件需具旅行社經驗及熟悉ABCUS訂位系統，抗壓性高",台北市大安區,1年以上,日班,月薪,35000,-,專科,"https://job.taiwanjobs.gov.tw/Internet/jobwanted/JobDetail.aspx?EMPLOYER_ID=355911&HIRE_ID=13398057","華友旅行社有限公司",20250313
"米其林一星 ＊ Ad Astra 餐廳 【 正職 外場服務人員 】",全職,16,旅遊／餐飲／休閒,160207,餐飲服務及接待員,2,額滿為止,"1. 負責餐前準備、清潔、備品等。2. 餐期協助帶位、送餐、倒水、料理介紹、結帳等現場工作。3. 餐期結束協助桌面收拾、環境清潔、餐具及杯子擦拭歸位。4. 進行簡易飲料製作等。",台北市中山區,無,中班,月薪,35000,40000,不拘,"https://job.taiwanjobs.gov.tw/Internet/jobwanted/JobDetail.aspx?EMPLOYER_ID=2565033&HIRE_ID=13468749","千雅股份有限公司",20250410
"產品部-國旅OP(台北)(0506校徵)",全職,16,旅遊／餐飲／休閒,160108,OP／旅行社人員,1,20250618,"1.行程之出團、結團相關作業2.領隊人員出團交接、回團作業3.供應商聯繫、對帳與請款4.交通、景點、食宿預定、開票與保險5.部門間聯繫溝通6.主管交辦事項",台北市松山區,無,日班,月薪,32000,37000,專科,"https://job.taiwanjobs.gov.tw/Internet/jobwanted/JobDetail.aspx?EMPLOYER_ID=800334&HIRE_ID=13487857","五福旅行社股份有限公司",20250421
"機台維修人員(台北第五分隊)",全職,10,技術／維修／操作,100290,其他產品維修人員,2,額滿為止,"ATM機台之故障排除&定期保養等工作薪資福利待遇佳（月領31400元起，服勤174小時起加班費另計）當月無事故者另可支領獎金1000元、季獎金；薪資因加班時數而異上班時間依排班值勤具備駕照普通重型機車、普通小型車",台北市中山區,無,日班,月薪,31400,60000,高中,"https://job.taiwanjobs.gov.tw/Internet/jobwanted/JobDetail.aspx?EMPLOYER_ID=18974&HIRE_ID=13461555","台灣保全股份有限公司",20250410
"行政管理師/行政專員/行政助理(0506校徵)",全職,01,經營／行政／總務,010206,行政助理,1,20250628,"◎#031.負責提供辦公室行政支援。2.與行政、財務和支援團隊密切合作",台北市中山區,無,日班,月薪,35000,-,大學,"https://job.taiwanjobs.gov.tw/Internet/jobwanted/JobDetail.aspx?EMPLOYER_ID=2567199&HIRE_ID=13505037","印度商塔塔顧問服務有限公司台灣分公司",20250428
"拉亞-農安 萬華兼職【時薪+獎金最高可達$200】彈性排班",全職,16,旅遊／餐飲／休閒,160207,餐飲服務及接待員,1,額滿為止,"榮獲連鎖早餐品牌幸福企業這是一個讓你開心上班、有活力、比太陽還早下班的好工作，好職缺數量有限，希望勇敢嘗試的你可以帶著一顆誠摯、認真的心來加入我們的行列！☑️【工作內容】1.餐飲製作及品質標準維持2.餐飲銷售及服務3.硬體設備維護及門市環境清潔整理4.個性開朗，具基本之溝通能力5.上班時間為05:30~14:30、10:00~14:30 (彈性排班)6.配合時數達140H以上，另有高工時獎金。7.通過各級考核與加計工作獎金，時薪最高可達200元 。★彈性排班如果你活潑愛熱鬧我們在找 YOU ☛ 學習成長、規劃未來就是現在!! 其他條件對餐飲及服務工作有熱情，有衝勁的您，歡迎加入我們！",台北市萬華區,無,日班,時薪,190,200,高中,"https://job.taiwanjobs.gov.tw/Internet/jobwanted/JobDetail.aspx?EMPLOYER_ID=1127296&HIRE_ID=13387155","商邦餐飲有限公司",20250305
"【杏子豬排】台北車站微風店-外場副店長",全職,01,經營／行政／總務,010101,經營管理主管,2,20250610,"1.門市營運經營管理代店2.協助店長達成經營KPI目標 3.公司策略執行與推動，激勵團隊合作，重視細節，執行力強 4.營運現場值班作業、人力調配、人員訓練執行5.產品品質管控6.行政業務執行【工作時間】1.排班制，需輪早/中/晚/假日班，工作時間9:00~22:00(依各百貨營業時間會有調整)2.每日排班8小時＜中間另有休息時間1~2小時(視營運狀況而定)＞",台北市中正區,2年以上,日班、中班,月薪,43000,-,高中,"https://job.taiwanjobs.gov.tw/Internet/jobwanted/JobDetail.aspx?EMPLOYER_ID=2311647&HIRE_ID=13467983","王座國際餐飲股份有限公司",20250410
"營運儲備幹部(5/8信義站小徵)",全職,01,經營／行政／總務,010105,儲備幹部,30,20250508,"1.營運現場各大工作站流程熟悉與管理。2.商品知識與食品安全概念的認識與執行。3.顧客服務技巧、客訴處理、產品面銷、商圈經營。4.庫存管理/盤點、設備維護。5.現金管理、營業報表分析、營運成本的控管。6.人員領導統馭、人才培育。",台北市不限,無,輪班三班制,月薪,34000,36000,專科,"https://job.taiwanjobs.gov.tw/Internet/jobwanted/JobDetail.aspx?EMPLOYER_ID=41434&HIRE_ID=13512005","安心食品服務股份有限公司",20250501
"台北業務專員—POS軟體(此為現場徵才活動職缺)",全職,02,業務／貿易／銷售,020102,業務人員,1,20250519,"業務工作內容：1.負責大台北地區POS系統業務銷售。2.約訪潛在客戶進行產品介紹、促進業務合作，及洽談合約。3.依業務績效達成率，提撥季獎金。114年5月17日（六）「畢業季暨北市科技園區聯合招募活動」活動時間：114年5月17日（六）10：30 ～16：00 (請於15:30前入場)活動地點：臺北車站1樓車站大廳(臺北市中正區北平西路三號) 洽詢電話：02-2338-0277*****請親洽*****想要知道更多活動資訊詳情請查詢 https://okwork.gov.taipei",台北市內湖區,無,日班,月薪,35000,-,專科,"https://job.taiwanjobs.gov.tw/Internet/jobwanted/JobDetail.aspx?EMPLOYER_ID=209183&HIRE_ID=13462669","南京資訊股份有限公司",20250409
"拉亞-農安門市-兼職【時薪$190~$200】",全職,16,旅遊／餐飲／休閒,160207,餐飲服務及接待員,1,額滿為止,"★榮獲連鎖早餐品牌幸福企業★這是一個讓你開心上班、有活力、比太陽還早下班的好工作，好職缺數量有限，希望勇敢嘗試的你可以帶著一顆誠摯、認真的心來加入我們的行列！☑️【工作內容】1.櫃檯pos機操作點餐出餐2.餐飲製作及品質標準維持3.硬體設備維護及門市環境清潔整理4.個性開朗，具基本溝通能力5.上班時間為05:30~14:306.通過各級考核與加計工作獎金，時薪最高可達200元 。★彈性排班如果你活潑愛熱鬧我們在找 YOU ☛ 學習成長、規劃未來就是現在!! 其他條件對餐飲及服務工作有熱情，有衝勁的您，歡迎加入我們！ ",台北市中山區,無,日班,時薪,190,200,高中,"https://job.taiwanjobs.gov.tw/Internet/jobwanted/JobDetail.aspx?EMPLOYER_ID=1127296&HIRE_ID=13386767","商邦餐飲有限公司",20250305
"計時人員5/8",全職,16,旅遊／餐飲／休閒,160207,餐飲服務及接待員,10,20250508,"1.備餐、送餐、徹餐與顧客互動等【信義站5/8(四)14:00-16:00現場徵才活動】",台北市不限,無,輪班二班制,時薪,205,215,高職,"https://job.taiwanjobs.gov.tw/Internet/jobwanted/JobDetail.aspx?EMPLOYER_ID=2364205&HIRE_ID=13509873","群品餐飲股份有限公司",20250430
"拉亞-萬華兼職【$190時薪+獎金最高可達$200】睡飽來打工",全職,16,旅遊／餐飲／休閒,160207,餐飲服務及接待員,1,額滿為止,"這是一個讓你開心上班、有活力、比太陽還早下班的好工作，好職缺數量有限，希望勇敢嘗試的你可以帶著一顆誠摯、認真的心來加入我們的行列！☑️【工作內容】1.餐飲製作及品質標準維持2.餐飲銷售及服務3.硬體設備維護及門市環境清潔整理4.個性開朗，具基本之溝通能力5.營運時間為05:30-14:30★彈性排班如果你活潑愛熱鬧我們在找 YOU ☛ 學習成長、規劃未來就是現在!!其他條件對餐飲及服務工作有熱情，有衝勁的您，歡迎加入我們！",台北市萬華區,無,日班,時薪,190,200,高中,"https://job.taiwanjobs.gov.tw/Internet/jobwanted/JobDetail.aspx?EMPLOYER_ID=883191&HIRE_ID=13405557","森邦股份有限公司",20250312
"【台北】國外事業部–業務助理(0506校徵)",全職,02,業務／貿易／銷售,020103,業務助理,1,20250625,"1.基本文書處理2.協助國外代理報價與追蹤3.負責進出口國外代理連絡事務4.代理合約審核5.貨物出貨與追蹤等相關事務6.處理主管交辦事項",台北市中山區,無,日班,月薪,32000,32000,大學,"https://job.taiwanjobs.gov.tw/Internet/jobwanted/JobDetail.aspx?EMPLOYER_ID=678947&HIRE_ID=13501333","萬達國際物流股份有限公司",20250425
"家樂福生鮮營運專員5/8",全職,06,客服／門市,060203,專櫃／門市（人員／儲備幹部）,10,20250508,"1.商品上架陳列、排面整理2.烤物製作.現烤麵包製作3.賣場環境管理及清潔4.生鮮蔬果商品品檢5.顧客服務、具有服務熱忱6.收銀結帳7.主管交辦事項8.需配合生鮮盤點兼職時薪190元【信義站5/8(四)14:00-16:00現場徵才活動】",台北市不限,無,日班、中班,月薪,29000,-,不拘,"https://job.taiwanjobs.gov.tw/Internet/jobwanted/JobDetail.aspx?EMPLOYER_ID=97015&HIRE_ID=13509945","統康生活事業股份有限公司",20250430
"【CAFE!N 硬咖啡】復北門市➤長期兼職(歡迎二度就業)",全職,06,客服／門市,060203,專櫃／門市（人員／儲備幹部）,1,額滿為止,"實現咖啡人的理想目標，學習咖啡的基本知識咖啡香環繞的上班環境，時時保持笑容及愉悅的心情1.使用全自動咖啡機依照SOP製作咖啡等飲品2.簡易餐點或輕食製作3.維持門市清潔，器具與杯具進行清潔4.商品銷售與收銀5.定期進行庫存盤點並負責訂貨6.支援門市間的輪調與協作無經驗者亦可，具經驗者更佳。只要您有熱情，願意與我們一起成長，CAFEIN 期待您的加入！其他條件●熱愛咖啡，對品味生活與時尚潮流充滿興趣者●重視團隊合作，並渴望在工作中獲得成就感●願意配合輪班，並可調動至其他門市拓展工作經驗●想更了解我們，歡迎訪問公司官網與 Instagram官網：https://www.cafein.com.twInstagram：https://www.instagram.com/cafeintw/",台北市中山區,無,日班、夜班,時薪,190,-,高中,"https://job.taiwanjobs.gov.tw/Internet/jobwanted/JobDetail.aspx?EMPLOYER_ID=2452029&HIRE_ID=13505343","阿發布雷克股份有限公司",20250428
"日班／夜班保全人員",全職,18,保全／軍警消,180101,保全人員,10,20250630,"從事巡邏、守衛，以及安全維護等工作。",台北市不限,無,日班、夜班,月薪,30300,44000,高職,"https://job.taiwanjobs.gov.tw/Internet/jobwanted/JobDetail.aspx?EMPLOYER_ID=7218&HIRE_ID=13416277","安橋保全股份有限公司",20250318
"客服業務",全職,02,業務／貿易／銷售,020102,業務人員,2,額滿為止,"銷售旅遊產品及辦理簽證",台北市松山區,無,日班,月薪,30000,80000,高中,"https://job.taiwanjobs.gov.tw/Internet/jobwanted/JobDetail.aspx?EMPLOYER_ID=2566709&HIRE_ID=13486219","泛太平洋國際旅行社有限公司 ",20250418
"【時薪200】花月嵐-統一時代店—外場/內場 兼職人員",全職,16,旅遊／餐飲／休閒,160207,餐飲服務及接待員,5,額滿為止,"●外場：領台帶位、菜單介紹、餐點收送、客席整理。 ●內場：餐點製作、食材備製、品質確認、設備維養、環境清潔。 早班：08:00~18:00(每日4~8小時，彈性排班) 晚班：17:00~23:00(每日4~6小時，彈性排班) ※※※ 假日需可配合排班 ※※※ ※※※ 活潑、熱情、有朝氣、優先錄用 ※※※ ※※※ 表現優異者、優先晉升管理幹部 ※※※",台北市信義區,無,日班、夜班、輪班二班制,時薪,200,-,高中,"https://job.taiwanjobs.gov.tw/Internet/jobwanted/JobDetail.aspx?EMPLOYER_ID=876262&HIRE_ID=13484947","晶旺餐飲股份有限公司",20250425
"(台北六福居)櫃檯組長/櫃檯接待",全職,16,旅遊／餐飲／休閒,160205,飯店工作人員,1,額滿為止,"1. 房客住房及退房接待，協助客人辦理入住手續，處理房帳等相關事宜。2. 顧客關係處理，協助客人處理入住期間事宜。3. 具溝通協調能力、聆聽、正確記錄及顧客抱怨處理能力。4. 具服務熱忱與善於人際溝通，抗壓性高。5. 熟悉OPERA系統者加分。",台北市中山區,無,日班、夜班,月薪,32000,40000,不拘,"https://job.taiwanjobs.gov.tw/Internet/jobwanted/JobDetail.aspx?EMPLOYER_ID=2256623&HIRE_ID=13475769","六福開發股份有限公司南港分公司",20250415
"行銷企劃助理人員",全職,21,行銷／企劃／專案,210202,網站行銷企劃,1,20301231,"負責網站規劃或透過網路行銷的方式，達到品牌、產品、活動之推廣工作及撰寫行銷方案等工作。",台北市大同區,2年以上,日班,月薪,38000,42000,不拘,"https://job.taiwanjobs.gov.tw/Internet/jobwanted/JobDetail.aspx?EMPLOYER_ID=969021&HIRE_ID=13411383","房日美室內裝修有限公司",20250319
"內場餐廚助手",兼職,16,旅遊／餐飲／休閒,160206,廚師助理,2,20331231,"1.負責洗、剝、削、切各種食材，以完成烹飪的前置工作。2.協助廚師測量食材的容量與重量。3.依照客人的點單，準備不同菜色所需要的食材。4.於出菜時負責菜餚擺盤或調整份量之工作。5.準備於營業時間內的點菜或宴會所需菜餚。6.確保所負責類別的食品均符合衛生管理的規定。7.維持與確保冷凍庫及工作區域的衛生及清潔整理標準。8.保持烹飪材料的適當存量。9.清理清潔乾淨廚房一切相關事務。10.點菜，備料，員工餐．",台北市大安區,無,部份工時：14時00分至22時00分,月薪,28590,40000,不拘,"https://job.taiwanjobs.gov.tw/Internet/jobwanted/JobDetail.aspx?EMPLOYER_ID=2481243&HIRE_ID=11787005","瑪可士西班牙料理有限公司",20230220
"【台北】PT房務員，時薪最高可達200元【路徒PLUS行旅主題館】@好玩、活力、成長、信任",全職,16,旅遊／餐飲／休閒,160205,飯店工作人員,5,額滿為止,"※無經驗可，需學習做房揮揮衣袖， 帶走的不是雲彩，而是遊人奔波的疲頓。 小鹿世界正殷切期盼您的來臨， 施展小精靈般的魔法， 賦予萬物重生， 換來駐留旅人的一抹微笑與最誠摯的感動。 ========================== 職務內容：1.客房清潔整理、房間備品補充，洗滌旅客疲憊的心靈。 2.客房設備定期清潔保養，展現煥然一新的魅力！ 3.公共區域清潔，從寢室到迴廊都獻上最美好的贈禮。 4.其他主管交辦事項 一週需排3~5天班，依一例一休排班，第6日上班給付加班費具房務技能者也可以談依您做房的能力評估用買房的方式未具房務技能者，學習期間每小時工資190元小鹿文娛官網：https://fawn-group.com/ 路徒PLUS行旅官網：https://roadersplushotel.com/",台北市中正區,無,日班,時薪,190,200,不拘,"https://job.taiwanjobs.gov.tw/Internet/jobwanted/JobDetail.aspx?EMPLOYER_ID=2391877&HIRE_ID=13500591","小鹿文娛股份有限公司",20250424
"★☆★2025年中盛大開幕★☆★【點點心-ATT信義店】外場儲備幹部~(月薪35000元-50000元) ✦另享最高【$2,640元】出勤獎勵金✦",全職,06,客服／門市,060205,連鎖店管理人員,5,額滿為止,"1. 執行桌邊及餐食服務，如倒水、點菜、送菜、撤桌..等工作。2. 負責開餐前準備工作，補齊工作站內之餐具及備品。3. 維持負責區域之整潔，以提供顧客舒適乾淨的用餐環境。 4. 依公司計劃完成每月營業目標(如：物料管理、成本控制、人員調動..等)。5. 學習並執行人員排班管理、工作安排、教育訓練、執行優質顧客服務與客訴處理。6. 其他主管交辦事項。✨擴大徵才✨ 歡迎熱情的您們加入緯豆大家庭✨     我們有透明、公正、與公平的晉升考核制度，每年固定舉辦2次。     我捫有歡樂、愉快的工作環境     我們有健全的福利與制度     還有更多更多~ ~ 等您們來挑戰與創造 ✌✌ ★☆ 每月出勤時數達65小時以上，且符合出勤規範標準者，每小時額外加發【$15元】出勤獎勵金，每月最高可領【$2,640元】。『例如』當月份沒有請/休假，每月正常出勤時數應為176小時，核發獎勵金為：$15元ｘ176小時= $2,640元；如有加班，另計。------------------------------------------------------------------------※開幕前，將安排您至鄰近的門市受訓※※預計2025年中盛大開幕！管理責任管理13人以上其他條件★經面試錄取，報到需繳交餐飲業(供膳檢查)體檢合格報告。",台北市信義區,3年以上,日班、夜班,月薪,35000,50000,高中,"https://job.taiwanjobs.gov.tw/Internet/jobwanted/JobDetail.aspx?EMPLOYER_ID=2260963&HIRE_ID=13508999","點點心股份有限公司",20250501
"企業用戶專員",全職,04,財務／金融／保險,040107,稽核人員,1,20250515,"此為現場徵才職缺【5/8(四)10:30-14:00於『真理大學』校園就業博覽會】，廠商完整職缺內容，請上新北人力網「附件下載」查看""1.企業客戶合約洽談、簽立、執行。2.提貨券銷售及門市請領提貨券各項事務。3.訂單處理進度，應收帳款相關事宜。4.維繫原有企業客戶，協助門市開發具潛力的企業客戶。5.有業務、客服經驗者佳。6.具備基礎會計帳務概念。""",台北市內湖區,無,日班,月薪,30000,35000,專科,"https://job.taiwanjobs.gov.tw/Internet/jobwanted/JobDetail.aspx?EMPLOYER_ID=5813&HIRE_ID=13511417","燦坤實業股份有限公司",20250501
"(台北六福萬怡酒店)(無經驗可)餐務課 兼職洗碗人員",全職,16,旅遊／餐飲／休閒,160208,廚務清潔員,2,額滿為止,"1. 負責餐具器皿洗滌及保養。2. 負責洗碗機洗滌及操作。3. 環境整潔維護。4. 其他主管交辦事項。",台北市南港區,無,日班、夜班,時薪,190,210,不拘,"https://job.taiwanjobs.gov.tw/Internet/jobwanted/JobDetail.aspx?EMPLOYER_ID=2256623&HIRE_ID=13476981","六福開發股份有限公司南港分公司",20250415
"門市店襄理-南港/松山/內湖地區",全職,01,經營／行政／總務,010105,儲備幹部,5,額滿為止,"1. 連鎖速食店現場各項品質管理。2. 當班人員管理與教育訓練。3. 門市營運績效提升。4. 年平均月休9-10天(依門市排班)。5. 薪資$ 41,360起     (月薪$ 36,027起 + 區域津貼2,000 + 月在職獎金$ 3,333；月在職獎金每半年進行發放)6. 年薪13個月，另依公司及單店營運發放獎金。7. 服務滿90天(扣除期間事病假滿90天)發放$ 5,000獎勵，服務滿 180天(扣除期間事病假滿180天)發放$ 10,000獎勵。(依服務滿期獎勵辦法辦理)管理13人以上上班時段日班/晚班，排班區間09:00~23:00(輪班、排班、加班等皆符合勞動基準法令相關規定)，需輪班工作技能客訴案件處理、門市餐飲管理、食物製前準備、廚房設備維護管理其他條件1.具領導3~5人團隊經驗2.具備餐飲業管理經驗佳3.可配合區域內輪調意者請電子郵寄履歷或至104人力銀行投遞線上履歷(優先處理)，合者會主動通知",台北市松山區,2年以上,日班、夜班,月薪,36027,-,不拘,"https://job.taiwanjobs.gov.tw/Internet/jobwanted/JobDetail.aspx?EMPLOYER_ID=98205&HIRE_ID=13499829","二十一世紀生活事業股份有限公司",20250424
"【台北區】文字客服專員(知名共享車位品牌專席服務)",全職,06,客服／門市,060102,客戶服務人員,2,20351231,"1.負責知名共享車位專席文字客服，提供諮詢服務及問題解決。2.客訴處理及安撫。【上班時間】★早、午輪班早班 09：00 ～ 18：00午班 12：30 ～ 21：30★無需輪值大夜班。★月休8-10天。★非派遣/業務性質工作，無需推銷。★薪資＋班別津貼＋排班獎金＋評核獎金。",台北市大安區,1年以上,,月薪,33000,34000,專科,"https://job.taiwanjobs.gov.tw/Internet/jobwanted/JobDetail.aspx?EMPLOYER_ID=302421&HIRE_ID=13205639","永昇國際開發股份有限公司",20250213
"中廚房-二/三廚",全職,16,旅遊／餐飲／休閒,160202,中/西餐烹飪廚師,2,20250509,"1. 負責熱菜、冷盤製作 2. 協助切割、烹飪工作3. 廚房清潔保養工作4. 主管交辦事項5. 需輪兩頭班(另有空班津貼)",台北市中山區,無,,月薪,32000,40000,高中,"https://job.taiwanjobs.gov.tw/Internet/jobwanted/JobDetail.aspx?EMPLOYER_ID=1185345&HIRE_ID=12760375","大地國際酒店股份有限公司",20240509
"機電員(商辦)",全職,10,技術／維修／操作,100102,電機技術人員,2,20250613,"商場機電巡檢紀錄、設備點交機電監控外包商監督及管理",台北市不限,無,輪班三班制,月薪,36000,40000,高職,"https://job.taiwanjobs.gov.tw/Internet/jobwanted/JobDetail.aspx?EMPLOYER_ID=130766&HIRE_ID=13472221","安橋公寓大廈管理維護股份有限公司",20250414
"BD 商務拓展顧問（此為現場徵才活動職缺）",全職,02,業務／貿易／銷售,020102,業務人員,2,20250519,"114年5月17日（六）「畢業季暨北市科技園區聯合招募活動」活動時間：114年5月17日（六）10：30 ～16：00 (請於15:30前入場)活動地點：臺北車站1樓車站大廳(臺北市中正區北平西路三號) 洽詢電話：02-2338-0277*****請親洽*****想要知道更多活動資訊詳情請查詢 https://okwork.gov.taipei1.負責數位零售OMO系統服務之規劃及銷售，開拓潛在商務機會2.提升客戶數位服務績效，協助提案規劃及執行3.關注市場新技術與應用趨勢，研究市場成功案例，掌握市場動態4.拓展潛在客戶及合作夥伴，維繫既有客群關係※有技術背景經驗加分",台北市中正區,無,日班,月薪,40000,-,大學,"https://job.taiwanjobs.gov.tw/Internet/jobwanted/JobDetail.aspx?EMPLOYER_ID=937560&HIRE_ID=13451841","康太數位整合股份有限公司",20250402
"客服專員",全職,06,客服／門市,060102,客戶服務人員,2,20250505,"客服中心接待業務，接聽電話，接受諮詢並協助客人解決問題",台北市信義區,無,輪班二班制,月薪,32000,36000,不拘,"https://job.taiwanjobs.gov.tw/Internet/jobwanted/JobDetail.aspx?EMPLOYER_ID=1165891&HIRE_ID=13384829","寒舍國際酒店股份有限公司",20250305
"大夜計時清潔人員光復5/8",全職,19,清潔／家事／托育(保母),190104,環境清潔工,5,20250508,"清潔餐廳環境【信義站5/8(四)14:00-16:00現場徵才活動】",台北市信義區,無,夜班,時薪,190,245,不拘,"https://job.taiwanjobs.gov.tw/Internet/jobwanted/JobDetail.aspx?EMPLOYER_ID=1280&HIRE_ID=13509627","和德昌股份有限公司",20250430
"四海餐飲服務人員-台北市中山區伊通店-兼職",兼職,16,旅遊／餐飲／休閒,160207,餐飲服務及接待員,5,額滿為止,"誠   　徵：早班兼職工作內容:1.外場顧客接待及需求(餐點、環境整理、打烊工作) 。2.簡易餐飲之料理烹飪(鍋貼包製，鍋貼煎製，麵食烹煮)。3.提供完整教育訓練及完善升遷管道。4.上班時間:11:00~14:00具備駕照輕型機車、普通重型機車其他條件需配合外送",台北市中山區,無,部份工時：時分至時分,時薪,200,-,不拘,"https://job.taiwanjobs.gov.tw/Internet/jobwanted/JobDetail.aspx?EMPLOYER_ID=2226219&HIRE_ID=13471797","四海遊龍食品股份有限公司",20250411
